COLE_COD_DANE_ESTABLECIMIENTO,COLE_NOMBRE_ESTABLECIMIENTO,COLE_GENERO,COLE_NATURALEZA,COLE_CARACTER,COLE_AREA_UBICACION,COLE_COD_MCPIO_UBICACION
311001016933,COL MI PATRIA,MIXTO,NO OFICIAL,ACADÉMICO,URBANO,11001
252786000504,INSTITUCION EDUCATIVA AGROPECUARIA EL REMOLINO,MIXTO,OFICIAL,TÉCNICO/ACADÉMICO,RURAL,52786
219142000204,I.E. INTEGRADO OBANDO,MIXTO,OFICIAL,ACADÉMICO,RURAL,19300
217088000098,INSTITUCION EDUCATIVA EL MADROÑO,MIXTO,OFICIAL,ACADÉMICO,RURAL,17088
215572000393,IE PUERTO PINZON,MIXTO,OFICIAL,ACADÉMICO,RURAL,15572
223807000208,IE LOS VOLCANES,MIXTO,OFICIAL,ACADÉMICO,RURAL,23807
311001106410,INST POLITECNICO JOSE CELESTINO MUTIS,MIXTO,NO OFICIAL,ACADÉMICO,URBANO,11001
217388000383,INSTITUCION EDUCATIVA LLANADAS,MIXTO,OFICIAL,ACADÉMICO,RURAL,17388
315001002237,COL COOP COOSERVICIOS,MIXTO,NO OFICIAL,ACADÉMICO,URBANO,15001
325754004441,LICEO MARIA INMACULADA,MIXTO,NO OFICIAL,ACADÉMICO,URBANO,25754
413549001575,I.E. DE PUERTO RICO,MIXTO,OFICIAL,ACADÉMICO,URBANO,13810
205400000213,I. E. MARCO EMILIO LOPEZ GALLEGO,MIXTO,OFICIAL,ACADÉMICO,RURAL,5400
205129000121,I. E. R. DARIO GUTIERREZ RAVE,MIXTO,OFICIAL,ACADÉMICO,RURAL,5129
220570000080,C.E. MINAS DE IRACAL,MIXTO,OFICIAL,TÉCNICO/ACADÉMICO,RURAL,20570
276233000715,IE BORRERO AYERBE,MIXTO,OFICIAL,TÉCNICO,RURAL,76233
347189002751,INSTITUTO NUEVA ENSENANZA,MIXTO,NO OFICIAL,ACADÉMICO,URBANO,47189
205697000144,I. E. PBRO. JESUS ANTONIO GOMEZ,MIXTO,OFICIAL,ACADÉMICO,RURAL,5697
368276000303,COL REINA DE LA PAZ,MIXTO,NO OFICIAL,ACADÉMICO,URBANO,68276
205240000106,I. E. R. BOYACA,MIXTO,OFICIAL,ACADÉMICO,RURAL,5240
268167000633,COLEGIO NUESTRA SEÑORA DEL ROSARIO,MIXTO,OFICIAL,ACADÉMICO,RURAL,68167
208560000031,I.E. MARTILLO,MIXTO,OFICIAL,ACADÉMICO,RURAL,8560
441006001926,COL POLICARPA SALAVARRIETA,MIXTO,NO OFICIAL,ACADÉMICO,URBANO,41006
252001003568,INSTITUCION EDUCATIVA JUAN PABLO II,MIXTO,OFICIAL,ACADÉMICO,URBANO,52480
317174000739,COLEGIO LATINOAMERICANO DE OCCIDENTE,MIXTO,NO OFICIAL,ACADÉMICO,URBANO,17174
425175032496,COLEGIO BERTRAND RUSSELL,MIXTO,NO OFICIAL,ACADÉMICO,RURAL,25175
270001038351,INSTITUCION EDUCATIVA TECNICO AGROPECUARIO LA GALLERA,MIXTO,OFICIAL,TÉCNICO,RURAL,70001
286865003553,I.E.R. EL VENADO,MIXTO,OFICIAL,TÉCNICO/ACADÉMICO,RURAL,86865
223686000132,INSTITUCION EDUCATIVA VALPARAISO,MIXTO,OFICIAL,ACADÉMICO,RURAL,23686
105001026697,INST EDUC FUNDADORES,MIXTO,OFICIAL,-,URBANO,5001
341503000531,INSTITUTO JAIBANÁ DEL HUILA,MIXTO,NO OFICIAL,ACADÉMICO,URBANO,41503
308001004829,CENTRO POPULAR ATANASIO GIRARDOT,MIXTO,NO OFICIAL,TÉCNICO,URBANO,8001
311001047502,GIMN MIX MANUEL DEL SOCORRO RODRIGUEZ,MIXTO,NO OFICIAL,ACADÉMICO,URBANO,11001
305001004579,COL PALERMO DE SAN JOSE,MIXTO,NO OFICIAL,ACADÉMICO,URBANO,5001
247288001168,I.E. DEPART. JUAN FRANCISCO OSPINA,MIXTO,OFICIAL,ACADÉMICO,RURAL,47288
354001008656,COL PEDAG DE LOS ANDES,MIXTO,NO OFICIAL,ACADÉMICO,URBANO,54001
325430000833,COLEGIO RAFAEL POMBO,MIXTO,NO OFICIAL,ACADÉMICO,URBANO,25430
268689000871,CONCENTRACION DESARROLLO RURAL JOSE ANTONIO GALAN,MIXTO,OFICIAL,TÉCNICO/ACADÉMICO,RURAL,68689
225407000040,I.E.R.D. SIMON BOLIVAR,MIXTO,OFICIAL,TÉCNICO/ACADÉMICO,RURAL,25407
205890000356,I. E. R. GUILLERMO AGUILAR,MIXTO,OFICIAL,TÉCNICO/ACADÉMICO,RURAL,5890
317001003961,COL. SAN MIGUEL - HORMIGUITA,MIXTO,NO OFICIAL,ACADÉMICO,URBANO,17001
311001019444,COL JOSE JOAQUIN VARGAS,MIXTO,NO OFICIAL,ACADÉMICO,URBANO,11001
308758076096,INSTITUTO ANTONIO GALAN DE SOLEDAD,MIXTO,NO OFICIAL,ACADÉMICO,URBANO,8758
176563000822,IE ALFREDO POSADA CORREA,MIXTO,OFICIAL,TÉCNICO,RURAL,76563
311001090866,COL CIUDAD DE FOMEQUE,MIXTO,NO OFICIAL,TÉCNICO/ACADÉMICO,URBANO,11001
311001091234,LIC CIAL NUEVO ALEJANDRINO,MIXTO,NO OFICIAL,TÉCNICO,URBANO,11001
311001087148,COL REMBRANDT,MIXTO,NO OFICIAL,ACADÉMICO,URBANO,11001
311001093130,COL CAMPESTRE MAXIMINO POITIERS,MIXTO,NO OFICIAL,ACADÉMICO,URBANO,11001
215047000153,IE SUSE,MIXTO,OFICIAL,ACADÉMICO,RURAL,15047
225269000211,I.E.M. JUAN XXIII TÉNICA EN ADMINISTRACIÓN AGROPECUARIA Y PROCESOS INDUSTRIALES,MIXTO,OFICIAL,TÉCNICO/ACADÉMICO,RURAL,25269
268464000448,INSTITUCION EDUCATIVA GUAURE,MIXTO,OFICIAL,TÉCNICO/ACADÉMICO,RURAL,68464
105001026573,IE LUSITANIA- PAZ DE COLOMBIA,MIXTO,OFICIAL,-,URBANO,5001
219075000041,I.E. OLAYA (ANTES C.E. OLAYA),MIXTO,OFICIAL,TÉCNICO,RURAL,19075
308001009448,COLEGIO COMUNAL MIXTO,MIXTO,NO OFICIAL,TÉCNICO,URBANO,8001
305001004528,COL MARIA REINA DEL CARMELO,MIXTO,NO OFICIAL,ACADÉMICO,URBANO,5001
219392000978,INSTITUCION EDUCATIVA LA DEPRESION (ANTES CENTRO EDUCATIVO LA DEPRESION),MIXTO,OFICIAL,TÉCNICO,RURAL,19392
320001069220,COLEGIO UZIEL QUERIT,MIXTO,NO OFICIAL,ACADÉMICO,URBANO,20001
354405000241,COL SAN TARSICIO LOS PATIOS,MIXTO,NO OFICIAL,ACADÉMICO,URBANO,54405
376670800008,COLEGIO INTEGRAL DE SAN PEDRO,MIXTO,NO OFICIAL,-,URBANO,76670
311001088403,COLEGIO INTEGRAL,MIXTO,NO OFICIAL,ACADÉMICO,URBANO,11001
368081003146,UNID PEDAGOGICA BILINGÜE PIERRE DE FERMAT,MIXTO,NO OFICIAL,ACADÉMICO,URBANO,68081
386749000452,IE SEMINARIO MISIONAL,MIXTO,OFICIAL,ACADÉMICO,URBANO,86749
415480000400,I.E. CONCHA MEDINA DE SILVA,MIXTO,OFICIAL,ACADÉMICO,RURAL,15480
205576000180,I. E. R. SINAI,MIXTO,OFICIAL,ACADÉMICO,RURAL,5576
286865002964,I.E.R. EL AFILADOR,MIXTO,OFICIAL,TÉCNICO/ACADÉMICO,RURAL,86757
425200000235,I. E. D. LA PLAZUELA,MIXTO,OFICIAL,TÉCNICO/ACADÉMICO,RURAL,25200
223182000069,INSTITUCION EDUCATIVA VILLA FATIMA,MIXTO,OFICIAL,ACADÉMICO,RURAL,23182
325473000802,INSTITUTO PEDAGÓGICO NUESTRA SEÑORA DEL PILAR,MIXTO,NO OFICIAL,ACADÉMICO,URBANO,25473
325754005331,COLEGIO BRITANICO,MIXTO,NO OFICIAL,-,URBANO,25754
370001039221,LICEO MANUEL DEL SOCORRO RODRIGUEZ,MIXTO,NO OFICIAL,ACADÉMICO,URBANO,70001
213001002531,I.E. MANZANILLO DEL MAR,MIXTO,OFICIAL,ACADÉMICO,RURAL,13001
405873000325,I. E. R. ALIANZA PARA EL PROGRESO,MIXTO,OFICIAL,ACADÉMICO,RURAL,5873
217444000201,INSTITUCION EDUCATIVA LA QUIEBRA,MIXTO,OFICIAL,ACADÉMICO,RURAL,17444
147570000099,INSTITUCION EDUCATIVA DEPARTAMENTAL SAN JOSE DE PUEBLO VIEJO,MIXTO,OFICIAL,TÉCNICO/ACADÉMICO,RURAL,47570
223675000343,INSTITUCION EDUCATIVA JUNIN,MIXTO,OFICIAL,ACADÉMICO,RURAL,23675
205480000341,I. E. R. LA INMACULADA CAUCHERAS,MIXTO,OFICIAL,ACADÉMICO,RURAL,5480
223189000978,INSTITUCION EDUCATIVA LOS MIMBRES CENTRO,MIXTO,OFICIAL,ACADÉMICO,RURAL,23189
366001006694,LICEO ANDINO,MIXTO,NO OFICIAL,ACADÉMICO,URBANO,66001
311001017557,COL DE NSTRA SRA DE LA PRESENTACION CENTRO,MIXTO,NO OFICIAL,ACADÉMICO,URBANO,11001
208372000040,INSTITUCION EDUCATIVA FERMIN TILANO,MIXTO,OFICIAL,ACADÉMICO,RURAL,8372
376001009087,COLEGIO HORIZONTES,MIXTO,NO OFICIAL,TÉCNICO/ACADÉMICO,URBANO,76001
325290001966,COL CRISTIANO INTEGRAL BETHESDA,MIXTO,NO OFICIAL,ACADÉMICO,URBANO,25290
227001003547,IE TECNICA AGROPECUARIA DE TAGACHI,MIXTO,OFICIAL,TÉCNICO,RURAL,27001
254520000188,CENT EDUC RUR LOS GUAYABALES,MIXTO,OFICIAL,ACADÉMICO,RURAL,54520
266594001274,CENT EDUC BTO EN BIENESTAR RURAL-QUINCHIA,MIXTO,OFICIAL,TÉCNICO,RURAL,66594
273026000587,INSTITUCION EDUCATIVA LUIS CARLOS GALAN SARMIENTO,MIXTO,OFICIAL,ACADÉMICO,RURAL,73026
305001025568,CENTRO DE ESTUDIOS MULTITÉCNICO,MIXTO,NO OFICIAL,ACADÉMICO,URBANO,5001
252699000549,INSTITUCION EDUCATIVA TECNICA  NUESTRA SEÑORA DE LOURDES,MIXTO,OFICIAL,TÉCNICO,RURAL,52699
366001000360,COL COMPAÑIA DE MARIA LA ENSEÑANZA,FEMENINO,NO OFICIAL,ACADÉMICO,URBANO,66001
305001017298,COL ARENYS DEL MAR,MIXTO,NO OFICIAL,ACADÉMICO,URBANO,5001
419532001421,I.E. JUAN BAUTISTA BOLAÑOS,MIXTO,OFICIAL,ACADÉMICO,RURAL,19532
252110000285,INSTITUCION EDUCATIVA SAN ANTONIO DE PADUA,MIXTO,OFICIAL,ACADÉMICO,RURAL,52110
268081002811,INSTITUCION EDUCATIVA AGROPECUARIO LA FORTUNA,MIXTO,OFICIAL,ACADÉMICO,RURAL,68081
213074001029,I.E.T.A. LUIS GUILLERMO VIDES ESCOBAR,MIXTO,OFICIAL,TÉCNICO,RURAL,13074
313001007091,COL. MODERNO DEL NORTE,MIXTO,NO OFICIAL,ACADÉMICO,URBANO,13001
276377000311,IE LA LIBERTAD,MIXTO,OFICIAL,TÉCNICO,RURAL,76377
268235000451,INSTITUCION EDUCATIVA  EL CENTENARIO,MIXTO,OFICIAL,ACADÉMICO,RURAL,68235
225297000529,INSTITUCIÓN EDUCATIVA DEPARTAMENTAL AGROPECUARIO PILOTO,MIXTO,OFICIAL,TÉCNICO/ACADÉMICO,RURAL,25297
283460000361,I.E.R LA RASTRA,MIXTO,OFICIAL,TÉCNICO/ACADÉMICO,RURAL,18460
223001000801,INSTITUCION EDUCATIVA SAN ISIDRO,MIXTO,OFICIAL,ACADÉMICO,RURAL,23001
376001021109,LICEO CAÑAVERAL DE OCCIDENTE,MIXTO,NO OFICIAL,TÉCNICO,URBANO,76001
311001032165,GIMNASIO CAMPESTRE STEPHEN HAWKING,MIXTO,NO OFICIAL,ACADÉMICO,URBANO,11001
219824001024,INST EDUC AGROP PUEBLO TOTORO,MIXTO,OFICIAL,TÉCNICO,RURAL,19824
311001027188,LIC CIAL LAS AMERICAS,MIXTO,NO OFICIAL,ACADÉMICO,URBANO,11001
108001800073,INSTITUCION EDUCATIVA DISTRITAL LAS GARDENIAS,MIXTO,OFICIAL,-,URBANO,8001
223001001689,INSTITUCION EDUCATIVA GUASIMAL,MIXTO,OFICIAL,ACADÉMICO,RURAL,23001
327361060015,IE INDÍGENA GERARDO CHIRIPUA VALENCIA,MIXTO,OFICIAL,TÉCNICO/ACADÉMICO,RURAL,27250
294001000369,I.E. BAS SAN PEDRO CLAVER,MIXTO,OFICIAL,ACADÉMICO,RURAL,94883
319455000731,CENTRO DE ESTUDIOS INTEGRADO MIRANDA,MIXTO,NO OFICIAL,-,URBANO,19455
215464000085,I.E. TUNJUELO,MIXTO,OFICIAL,TÉCNICO,RURAL,15464
266001001094,IE SAN JOAQUIN,MIXTO,OFICIAL,ACADÉMICO,URBANO,66001
376109009296,CENTRO  DOCENTE ANA VICTORIA,MIXTO,NO OFICIAL,ACADÉMICO,URBANO,76109
311102001082,INSTITUTO JUAN PABLO II,MIXTO,NO OFICIAL,ACADÉMICO,URBANO,11001
388001000681,COLEGIO LUIS AMIGO,MIXTO,NO OFICIAL,ACADÉMICO,URBANO,88001
350689001484,COLEGIO COFREM,MIXTO,NO OFICIAL,ACADÉMICO,URBANO,50689
241551000122,IE MUNICIPAL PALMARITO,MIXTO,OFICIAL,ACADÉMICO,RURAL,41551
215047000099,I.E. REGIÓN SUR DE AQUITANIA,MIXTO,OFICIAL,ACADÉMICO,RURAL,15047
305088001325,COL BETHLEMITAS,FEMENINO,NO OFICIAL,NO APLICA,URBANO,5088
223586000208,IE LOS CORRALES,MIXTO,OFICIAL,ACADÉMICO,RURAL,23586
223807000330,IE LOS MORALES,MIXTO,OFICIAL,ACADÉMICO,RURAL,23807
213006001649,INSTITUCION EDUCATIVA PLACIDO RETAMOZA,MIXTO,OFICIAL,ACADÉMICO,RURAL,13655
373319001256,INSTITUTO SERVICIO EDUCATIVO NACIONAL DE ADULTOS  SENDAS,MIXTO,NO OFICIAL,ACADÉMICO,URBANO,73319
325843000645,COL GIMN DE LOS ANDES,MIXTO,NO OFICIAL,ACADÉMICO,RURAL,25843
305001005541,COL NUESTRA MADRE DE LAS MERCEDES,FEMENINO,NO OFICIAL,ACADÉMICO,URBANO,5001
354001010006,COL CRISTIANO AMIGOS DE JESUCRISTO,MIXTO,NO OFICIAL,ACADÉMICO,URBANO,54001
219517001581,I.E. SAT¿ WESX ZUUN,MIXTO,OFICIAL,ACADÉMICO,RURAL,19517
311001038163,LIC SANTA PAULA,MIXTO,NO OFICIAL,ACADÉMICO,URBANO,11001
223001001620,INSTITUCION EDUCATIVA PUEBLO BUJO,MIXTO,OFICIAL,ACADÉMICO,RURAL,23001
225793000091,I.E.D. SAN ANTONIO,MIXTO,OFICIAL,ACADÉMICO,RURAL,25793
368307000749,LICEO SEÑOR DE LOS MILAGROS,MIXTO,NO OFICIAL,TÉCNICO/ACADÉMICO,URBANO,68307
223168000081,IE SEBASTIAN SANCHEZ,MIXTO,OFICIAL,ACADÉMICO,RURAL,23168
166456000393,IE INSTITUTO MISTRATO,MIXTO,OFICIAL,TÉCNICO/ACADÉMICO,RURAL,66456
219693000019,I.E. TÉCNICA EN SISTEMAS SANTIAGO,MIXTO,OFICIAL,ACADÉMICO,RURAL,19693
308001005418,COLEGIO 20 DE JULIO CENTRAL,MIXTO,NO OFICIAL,ACADÉMICO,URBANO,8001
311001107335,INST PEDAG LA REAL SOCIEDAD,MIXTO,NO OFICIAL,ACADÉMICO,URBANO,11001
325754005072,COLEGIO SAN JOSE F.E.S.S.J,MIXTO,NO OFICIAL,-,URBANO,25754
376001031431,COLEGIO COMERCIAL NUEVA ERA VALLEGRANDE,MIXTO,NO OFICIAL,TÉCNICO,URBANO,76001
215759000524,INSTITUCION EDUCATIVA LA INDEPENDENCIA,MIXTO,OFICIAL,TÉCNICO/ACADÉMICO,RURAL,15759
247720000011,INSTITUCION EDUCATIVA DEPARTAMENTAL RURAL SAGRADO CORAZON DE JESUS,MIXTO,OFICIAL,ACADÉMICO,RURAL,47720
223500000588,INSTITUCION EDUCATIVA NUESTRA SEÑORA DEL CARMEN,MIXTO,OFICIAL,ACADÉMICO,RURAL,23500
373483000886,SERVICIO EDUCATIVO NAL DE ADULTOS SENDAS,MIXTO,NO OFICIAL,ACADÉMICO,URBANO,73483
205490000098,I.E.R. MELLO VILLAVICENCIO,MIXTO,OFICIAL,ACADÉMICO,RURAL,5490
252540000033,CENTRO EDUCATIVO SANTA CRUZ,MIXTO,OFICIAL,ACADÉMICO,RURAL,52540
305001012601,COLEGIO JOSE MARIA BERRIO,MASCULINO,NO OFICIAL,ACADÉMICO,RURAL,5631
225815000392,INSTITUCION EDUCATIVA DEPARTAMENTAL RURAL PUBENZA,MIXTO,OFICIAL,ACADÉMICO,RURAL,25815
295105000987,I.E. ANTONIO NARIÑO EL UNILLA,MIXTO,OFICIAL,ACADÉMICO,RURAL,95025
205088000430,IE LA UNION,MIXTO,OFICIAL,TÉCNICO/ACADÉMICO,RURAL,5088
205686000924,I.E.R. SAN ISIDRO,MIXTO,OFICIAL,ACADÉMICO,RURAL,5686
305001012181,COL SAN JUAN EUDES,MIXTO,NO OFICIAL,ACADÉMICO,URBANO,5001
205093000413,I. E. R. LA SUCRE,MIXTO,OFICIAL,NO APLICA,RURAL,5847
311001102805,FUNDACION COLEGIO PRINCIPIO DE SABIDURIA,MIXTO,NO OFICIAL,ACADÉMICO,URBANO,11001
125335000541,"IED ""MONSEÑOR ALBERTO REYES FONSECA""",MIXTO,OFICIAL,TÉCNICO/ACADÉMICO,URBANO,25335
205440000305,I E R ROSALIA HOYOS,MIXTO,OFICIAL,ACADÉMICO,RURAL,5440
308001011094,ESCUELA MIXTA DOMINGO SABIO MODESTO,MIXTO,NO OFICIAL,ACADÉMICO,URBANO,8001
311001088314,GIMN CACERES,MIXTO,NO OFICIAL,ACADÉMICO,URBANO,11001
219622000051,I.E. EL MARQUEZ,MIXTO,OFICIAL,ACADÉMICO,RURAL,19622
354001001520,COL SEM DIOCESANO SAN JOSE DE CUCUTA,MASCULINO,NO OFICIAL,ACADÉMICO,URBANO,54001
347001003551,INSTITUTO MIDIA LEONOR CASTELLON DE SANCHEZ,MIXTO,NO OFICIAL,ACADÉMICO,URBANO,47001
105001026689,INST EDUC BLANQUIZAL,MIXTO,OFICIAL,-,URBANO,5001
215455000099,I.E. MIRAFLORES,MIXTO,OFICIAL,TÉCNICO,RURAL,15455
244430000868,INSTITUCION EDUCATIVA INDIGENA NO. 4,MIXTO,OFICIAL,ACADÉMICO,RURAL,44430
311001110492,INSTITUTO DANTE ALIGHIERI,MIXTO,NO OFICIAL,-,URBANO,11001
376001015371,CENTRO EDUCATIVO LEONARDO DA VINCI,MIXTO,NO OFICIAL,TÉCNICO,URBANO,76001
373168003626,COL DE EDUC BAS SEC Y MEDIA ACAD HEISENBERG,MIXTO,NO OFICIAL,ACADÉMICO,URBANO,73168
276834000666,INSTITUCION EDUCATIVA JOVITA SANTA COLOMA,MIXTO,OFICIAL,ACADÉMICO,RURAL,76834
250689001447,IE IRACA,MIXTO,OFICIAL,TÉCNICO/ACADÉMICO,RURAL,50689
313001006485,CORPORACION EDUCATIVA COLEGIO ALTER ALTERIS,MIXTO,NO OFICIAL,ACADÉMICO,URBANO,13001
205172000267,I. E. R. NEL UPEGUI,MIXTO,OFICIAL,NO APLICA,RURAL,5172
273319001197,INSTITUCION EDUCATIVA TECNICA CAÑADA RODEO,MIXTO,OFICIAL,TÉCNICO,RURAL,73319
311001052018,COL EL MINUTO DE DIOS SIGLO XXI,MIXTO,NO OFICIAL,ACADÉMICO,URBANO,11001
313001006337,INST. EL LABRADOR,MIXTO,NO OFICIAL,ACADÉMICO,URBANO,13001
223417000061,I.E. LOS GOMEZ,MIXTO,OFICIAL,ACADÉMICO,RURAL,23417
113744002329,INSTITUCI¿N EDUCATIVA T¿CNICA AGROPECUARIA Y COMERCIAL EUTIMIO GUTI¿RREZ MANJ¿N,MIXTO,OFICIAL,TÉCNICO,URBANO,13744
315238000964,COLEGIO SAN JOSE DE CALASANZ,MIXTO,NO OFICIAL,ACADÉMICO,URBANO,15238
305001003734,INST SAN CARLOS,MASCULINO,NO OFICIAL,ACADÉMICO,URBANO,5001
223660000762,INSTITUCION EDUCATIVA EL VIAJANO,MIXTO,OFICIAL,ACADÉMICO,RURAL,23660
223807000992,IE PALMIRA,MIXTO,OFICIAL,ACADÉMICO,RURAL,23807
311001087750,COL CRISTIANO GRACIA Y AMOR,MIXTO,NO OFICIAL,ACADÉMICO,URBANO,11001
205686000282,I.E.R. BOCA DEL MONTE,MIXTO,OFICIAL,ACADÉMICO,RURAL,5686
241357000693,IE KUE DSI J,MIXTO,OFICIAL,ACADÉMICO,RURAL,41357
252258000144,CENTRO EDUCATIVO  FATIMA,MIXTO,OFICIAL,ACADÉMICO,RURAL,52258
320011001402,COLEGIO TERESIANO REINA DEL CARMELO,MIXTO,NO OFICIAL,TÉCNICO/ACADÉMICO,URBANO,20011
299001002614,I.E. ANTONIA SANTOS,MIXTO,OFICIAL,ACADÉMICO,RURAL,99001
205649001287,INSTITUCION EDUCATIVA RURAL SAMANA,MIXTO,OFICIAL,-,RURAL,5649
311848002432,COL DE LA PRESENTACION SANS FACON,FEMENINO,NO OFICIAL,ACADÉMICO,URBANO,11001
286865001739,I.E.R. MARAVELEZ,MIXTO,OFICIAL,NO APLICA,RURAL,86865
223162000526,INSTITUCION EDUCATIVA SAN JOSE DEL QUEMADO,MIXTO,OFICIAL,ACADÉMICO,RURAL,23162
325473000632,LICEO CAMPESTRE EL BOSQUE,MIXTO,NO OFICIAL,ACADÉMICO,URBANO,25473
205209000335,C. E. R. LA COMIA,MIXTO,OFICIAL,NO APLICA,RURAL,5467
244560000151,INST ETNOEDUCATIVA LAACHON MAYAPO,MIXTO,OFICIAL,ACADÉMICO,RURAL,44560
313001008771,COL.  GIMN. MOMPIANO,MIXTO,NO OFICIAL,ACADÉMICO,URBANO,13001
315759002548,INSTITUTO POLITECNICO JOSE CELESTINO MUTIS,MIXTO,NO OFICIAL,ACADÉMICO,URBANO,15759
213001000091,INSTITUCION EDUCATIVA DE ISLA FUERTE,MIXTO,OFICIAL,TÉCNICO/ACADÉMICO,RURAL,13001
311001097615,LIC  ERNESTO CARDENAL,MIXTO,NO OFICIAL,NO APLICA,URBANO,11001
419130001450,INSTITUTO TECNICO AGROPECUARIO FORESTAL SMURFIT CARTON DE C.,MIXTO,NO OFICIAL,TÉCNICO/ACADÉMICO,RURAL,19130
205361000847,I. E. R. PALOBLANCO,MIXTO,OFICIAL,ACADÉMICO,RURAL,5361
308001002036,COLEGIO HERMANA VIRGINIA ROSSI,FEMENINO,NO OFICIAL,ACADÉMICO,URBANO,8001
276834001239,INSTITUCION EDUCATIVA LA MORALIA,MIXTO,OFICIAL,ACADÉMICO,RURAL,76834
376834004895,INSTITUCION EDUCATIVA PARA AL FORMACION EMPRESARIAL  I F E,MIXTO,NO OFICIAL,ACADÉMICO,URBANO,76834
311001106401,COL CHARLES BABBAGGE,MIXTO,NO OFICIAL,ACADÉMICO,URBANO,11001
241359000224,IE MONDEYAL,MIXTO,OFICIAL,ACADÉMICO,RURAL,41359
354001012351,INSTITUCION EDUCATIVA FRANCELENA NAVA CORREA,MIXTO,NO OFICIAL,ACADÉMICO,URBANO,54001
311001109524,COLEGIO INGLATERRA REAL DE CHAPINERO,MIXTO,NO OFICIAL,ACADÉMICO,URBANO,11001
325754001042,CENTRO EDUCATIVO COLOMBO LATINO,MIXTO,NO OFICIAL,ACADÉMICO,URBANO,25754
320011000066,COLEGIO BILINGUE LOS ANGELES,MIXTO,NO OFICIAL,ACADÉMICO,URBANO,20011
350001007077,IE LICEO GENERAL DE COLOMBIA,MIXTO,NO OFICIAL,ACADÉMICO,URBANO,50001
223678000506,INSTITUCION EDUCATIVA TREMENTINO ARRIBA,MIXTO,OFICIAL,ACADÉMICO,RURAL,23678
219355001191,I.E. MICROEMPRESARIAL AGROPECUARIO SAN ANDRÉS,MIXTO,OFICIAL,TÉCNICO,RURAL,19355
366001005183,COL SUR OCCIDENTE,MIXTO,NO OFICIAL,ACADÉMICO,URBANO,66001
227001001871,IE TECNICA AGROECOLOGICA CRISTO REY DE TUTUNENDO,MIXTO,OFICIAL,TÉCNICO,RURAL,27001
325175000784,FUND PARA EL NIÑO SORDO ICAL,MIXTO,NO OFICIAL,ACADÉMICO,RURAL,25175
325754005544,INSTITUTO GERWILL,MIXTO,NO OFICIAL,-,URBANO,25754
252356000535,INSTITUCION EDUCATIVA LA VICTORIA,MIXTO,OFICIAL,ACADÉMICO,RURAL,52356
286001000277,I.E.R. SIMON BOLIVAR,MIXTO,OFICIAL,ACADÉMICO,RURAL,86001
213549002319,INSTITUCION EDUCATIVA FRANCISCO DE PAULA SANTANDER,MIXTO,OFICIAL,ACADÉMICO,RURAL,13810
313001005411,COLEGIO FERNANDEZ GUTIERREZ DE PIÑERES,MIXTO,NO OFICIAL,ACADÉMICO,URBANO,13001
270001000125,INSTITUCION EDUCATIVA RURAL BUENAVISTA,MIXTO,OFICIAL,ACADÉMICO,RURAL,70001
325899001784,INSTITUTO PEDAGOGICO ESCALEMOS,MIXTO,NO OFICIAL,ACADÉMICO,RURAL,25200
205667000239,I. E. R. LA MESA,MIXTO,OFICIAL,NO APLICA,RURAL,5021
354001006955,COL TEC INNOVACION ESTUDIANTIL,MIXTO,NO OFICIAL,TÉCNICO/ACADÉMICO,URBANO,54001
311001098671,COL GEORGE WASHINGTON SCHOOL,MIXTO,NO OFICIAL,ACADÉMICO,URBANO,11001
317001007142,GIMNASIO CAMPESTRE LA CONSOLATA,MIXTO,NO OFICIAL,ACADÉMICO,URBANO,17001
247707000347,INSTITUCION EDUCATIVA DEPARTAMENTAL RURAL NUESTRA SE¿ORA DEL ROSARIO,MIXTO,OFICIAL,TÉCNICO/ACADÉMICO,RURAL,47720
268547000920,I.E. LOS CUROS,MIXTO,OFICIAL,ACADÉMICO,RURAL,68547
150001007833,COLEGIO SILVIA APONTE RODRIGUEZ,MIXTO,OFICIAL,-,URBANO,50001
368001000621,COL COOP DE BUCARAMANGA,MIXTO,NO OFICIAL,TÉCNICO/ACADÉMICO,URBANO,68001
468147000294,INSTITUTO TECNICO AGROINDUSTRIAL DE EDUCACION CAMPESINA,MIXTO,NO OFICIAL,ACADÉMICO,RURAL,68147
218150000331,I.E.R JOSE ANTONIO GALAN,MIXTO,OFICIAL,TÉCNICO/ACADÉMICO,RURAL,18150
468276000359,SEMINARIO CONCILIAR SAN PIO X,MASCULINO,NO OFICIAL,ACADÉMICO,URBANO,68276
268547000156,I.E. LA VEGA,MIXTO,OFICIAL,ACADÉMICO,RURAL,68547
311001094730,INST SAN FRANCISCO,MIXTO,NO OFICIAL,ACADÉMICO,URBANO,11001
311001000379,COL NSTRA SRA DE LAS VICTORIAS,MIXTO,NO OFICIAL,ACADÉMICO,URBANO,11001
425269004241,COLEGIO FERVAN CAMPESTRE,MIXTO,NO OFICIAL,-,RURAL,25269
252215000469,INSTITUCION EDUCATIVA SANTANDER,MIXTO,OFICIAL,TÉCNICO/ACADÉMICO,RURAL,52215
305001005109,COL LA ANUNCIACION,FEMENINO,NO OFICIAL,ACADÉMICO,URBANO,5001
313001008399,CENTRO EDUCATIVO LAS PALMERAS,MIXTO,NO OFICIAL,ACADÉMICO,URBANO,13001
319001002372,CENT EDUCATIVO DEL NORTE LA MERCED,MIXTO,NO OFICIAL,ACADÉMICO,URBANO,19001
205411000401,I. E. SAN DIEGO,MIXTO,OFICIAL,TÉCNICO/ACADÉMICO,RURAL,5411
376001029436,COL FE Y ESPERANZA MISION PANAMERICANA,MIXTO,NO OFICIAL,ACADÉMICO,URBANO,76001
311001106177,INST ANDRE MICHELIN,MIXTO,NO OFICIAL,TÉCNICO/ACADÉMICO,URBANO,11001
223660001084,INSTITUCION EDUCATIVA RODANIA,MIXTO,OFICIAL,ACADÉMICO,RURAL,23660
468500000441,INSTITUTO TECNICO PARA EL DESARROLLO RURAL IDEAR,MIXTO,NO OFICIAL,ACADÉMICO,URBANO,68500
219743000155,I.E. RENACER PÁEZ,MIXTO,OFICIAL,ACADÉMICO,RURAL,19743
319142001132,BACHILLERATO PARA ADULTOS MARIA AUXILIADORA,MIXTO,NO OFICIAL,ACADÉMICO,URBANO,19300
311001110042,FUNDACIÓN EDUCATIVA PARA EL DESARROLLO INTEGRAL - FEDI,MIXTO,NO OFICIAL,-,URBANO,11001
252678001154,INSTITUCION EDUCATIVA SIMON ALVAREZ,MIXTO,OFICIAL,TÉCNICO/ACADÉMICO,RURAL,52678
220383000114,I.E. NUESTRA SEÑORA DEL CARMEN,MIXTO,OFICIAL,TÉCNICO/ACADÉMICO,RURAL,20383
219142000263,I.E. LA NIÑA MARIA - CRUCERO DE GUALI,MIXTO,OFICIAL,ACADÉMICO,RURAL,19142
385001004581,LICEO CAMPESTRE ANDINO,MIXTO,NO OFICIAL,-,URBANO,85001
286865000597,I.E.R. EL ROSAL,MIXTO,OFICIAL,TÉCNICO/ACADÉMICO,RURAL,86865
225489000450,INSTITUCION EDUCATIVA DEPARTAMENTAL MISAEL PASTRANA BORRERO DE TOBIA,MIXTO,OFICIAL,TÉCNICO/ACADÉMICO,RURAL,25489
308001001889,COLEGIO DOMINGO SABIO,MIXTO,NO OFICIAL,ACADÉMICO,URBANO,8001
311001106592,COL HEISENBERG SEDE KENNEDY,MIXTO,NO OFICIAL,ACADÉMICO,URBANO,11001
376001008617,COL TEC CIAL SAN MARCOS DE LEON,MIXTO,NO OFICIAL,TÉCNICO/ACADÉMICO,URBANO,76001
268397000110,INSTITUCION EDUCATIVA  LA LOMA,MIXTO,OFICIAL,ACADÉMICO,RURAL,68397
281794000564,INSTITUCION EDUCATIVA AGUSTIN NIETO CABALLERO,MIXTO,OFICIAL,ACADÉMICO,RURAL,81794
250006001048,IE DINAMARCA,MIXTO,OFICIAL,TÉCNICO,RURAL,50006
311001006032,EXTERN PORFIRIO BARBA JACOB,MIXTO,NO OFICIAL,TÉCNICO/ACADÉMICO,URBANO,11001
205148000469,I. E.R. LA AURORA,MIXTO,OFICIAL,ACADÉMICO,RURAL,5148
325754005048,I.E. LICEO NUEVA VIDA,MIXTO,NO OFICIAL,ACADÉMICO,URBANO,25754
285410000649,IE EL CUSIANA,MIXTO,OFICIAL,ACADÉMICO,RURAL,85410
252411000582,INSTITUCION EDUCATIVA SAN FRANCISCO DE ASIS,MIXTO,OFICIAL,TÉCNICO,RURAL,52411
194001001026,I.E. LA PRIMAVERA,MIXTO,OFICIAL,TÉCNICO/ACADÉMICO,URBANO,94001
308001001013,COLEGIO NUESTRA SEÑORA DEL BUEN CONSEJO,FEMENINO,NO OFICIAL,ACADÉMICO,URBANO,8001
219517001653,I.E. TÉCNICA AGROPECUARIA DE RICAURTE,MIXTO,OFICIAL,TÉCNICO,RURAL,19517
223466002649,I.E. LA ESPERANZA,MIXTO,OFICIAL,ACADÉMICO,RURAL,23466
320001791677,INSTITUCION EDUCATIVA ISAAC NEWTON,MIXTO,NO OFICIAL,ACADÉMICO,URBANO,20001
320001004667,COL PERSONITAS,MIXTO,NO OFICIAL,NO APLICA,URBANO,20001
308758076363,COLEGIO GIMNASIO AMERICANO,MIXTO,NO OFICIAL,ACADÉMICO,URBANO,8758
273152000142,INSTITUCION EDUCATIVA ANTONIO NARIÑO,MIXTO,OFICIAL,ACADÉMICO,RURAL,73152
276863000543,IE CARLOS HOLGUIN SARDI,MIXTO,OFICIAL,TÉCNICO,RURAL,76863
311001010099,GIMN SAN JOSE,MIXTO,NO OFICIAL,ACADÉMICO,URBANO,11001
376001020536,COLEGIO  NUESTRA  SEÑORA  DE  LA PROVIDENCIA,MIXTO,NO OFICIAL,TÉCNICO,URBANO,76001
376001013131,COL MIX PEDRO MORALES PINO,MIXTO,NO OFICIAL,ACADÉMICO,URBANO,76001
319573000818,INSTITUTO DE FORMACION LABORAL INSDEFORLA,MIXTO,NO OFICIAL,ACADÉMICO,URBANO,19573
223672000202,INSTITUCION EDUCATIVA SANTA ROSA,MIXTO,OFICIAL,ACADÉMICO,RURAL,23672
223417000461,IE SAN LUIS CAMPO ALEGRE,MIXTO,OFICIAL,ACADÉMICO,RURAL,23417
219130000586,I.E. AGROPECUARIO LA CAPILLA,MIXTO,OFICIAL,TÉCNICO,RURAL,19130
227615002083,IE INDÍGENA UNION CHOGORODO,MIXTO,OFICIAL,ACADÉMICO,RURAL,27150
454001011597,INST PEDAG OCUPACIONAL,MIXTO,NO OFICIAL,ACADÉMICO,RURAL,54001
219001000880,I.E. LAS HUACAS,MIXTO,OFICIAL,ACADÉMICO,RURAL,19001
341807000731,COLEGIO ATENEO AUTONOMO,MIXTO,NO OFICIAL,ACADÉMICO,URBANO,41807
205591000099,I. E. R. DORADAL,MIXTO,OFICIAL,ACADÉMICO,RURAL,5591
325430000167,INSTITUTO ZORAIDA CADAVID DE SIERRA,FEMENINO,NO OFICIAL,TÉCNICO/ACADÉMICO,URBANO,25430
318001003879,COLEGIO ANDAKI,MIXTO,NO OFICIAL,ACADÉMICO,URBANO,18001
320550000037,IE JOSE MARIA TORTI SORIANO,MIXTO,OFICIAL,TÉCNICO/ACADÉMICO,URBANO,20550
308001013402,COLEGIO MIXTO MIGUEL DE CERVANTES SAAVEDRA,MIXTO,NO OFICIAL,NO APLICA,URBANO,8758
213052000355,I.E.T.A.  DE SINCERIN,MIXTO,OFICIAL,TÉCNICO,RURAL,13052
223001000437,INSTITUCION EDUCATIVA TRES PALMAS,MIXTO,OFICIAL,ACADÉMICO,RURAL,23001
311001094993,COL MAYOR DE GALES,MIXTO,NO OFICIAL,ACADÉMICO,URBANO,11001
315001002997,COL COOPTEBOY,MIXTO,NO OFICIAL,ACADÉMICO,URBANO,15001
215180000051,I.E. LAS CAÑAS,MIXTO,OFICIAL,TÉCNICO/ACADÉMICO,RURAL,15180
213600000423,I.E. COBADILLO,MIXTO,OFICIAL,ACADÉMICO,RURAL,13600
247189004228,INSTITUCION EDUCATIVA DEPARTAMENTAL THELMA ROSA AREVALO,MIXTO,OFICIAL,TÉCNICO/ACADÉMICO,RURAL,47980
344001000391,COLEGIO SARA DE LUQUE PANAFLET,MIXTO,NO OFICIAL,ACADÉMICO,URBANO,44001
354001000612,COL SAN TARSICIO,MIXTO,NO OFICIAL,ACADÉMICO,URBANO,54001
219517000754,INS EDUC JUAN TAMA (ANTES CENT EDUC DEL NORTE JUAN TAMA),MIXTO,OFICIAL,TÉCNICO,RURAL,19517
241676000132,IE LAS JUNTAS,MIXTO,OFICIAL,ACADÉMICO,RURAL,41676
325754005021,INSTITUTO EDUCATIVO COMERCIAL INEC,MIXTO,NO OFICIAL,-,URBANO,25754
273168000908,INSTITUCION EDUCATIVA SIMON BOLIVAR,MIXTO,OFICIAL,ACADÉMICO,RURAL,73168
311001005583,GIMN BOYACA,MIXTO,NO OFICIAL,ACADÉMICO,URBANO,11001
217873000375,INSTITUCION EDUCATIVA COLOMBIA,MIXTO,OFICIAL,TÉCNICO,RURAL,17873
311001046409,LIC  MODERNO LEON BAEZ,MIXTO,NO OFICIAL,NO APLICA,URBANO,11001
368079000322,INSTITUTO TECNICO PARA EL DESARROLLO RURAL IDEAR,MIXTO,NO OFICIAL,ACADÉMICO,RURAL,68079
244001002879,INSTITUCI¿N EDUCATIVA RURALADOLFO ANTONIO MINDIOLA ROBLES,MIXTO,OFICIAL,ACADÉMICO,RURAL,44090
470823000461,I.E. TÉCNICO AGROPECUARIO CARLOS ARTURO VERBEL VERGARA,MIXTO,OFICIAL,TÉCNICO,RURAL,70823
370001039239,CENTRO DE EDUCACION SEMIESCOLARIZADO DE LA COSTA  CESCOM,MIXTO,NO OFICIAL,ACADÉMICO,URBANO,70001
254128001427,C.E.R. LA CARRERA,MIXTO,OFICIAL,NO APLICA,RURAL,54128
115087000208,I.E.T. CARLOS ALBERTO OLANO VALDERRAMA,MIXTO,OFICIAL,TÉCNICO/ACADÉMICO,RURAL,15087
241298000293,IE TULIO ARBELAEZ,MIXTO,OFICIAL,ACADÉMICO,RURAL,41298
276616000581,IE HERNANDO LLORENTE ARROYO,MIXTO,OFICIAL,ACADÉMICO,RURAL,76616
219001001045,NOR- OCCIDENTE -  LA TETILLA,MIXTO,OFICIAL,TÉCNICO,RURAL,19001
273624001261,INSTITUCION EDUCATIVA TECNICA FELIPE SALAME,MIXTO,OFICIAL,TÉCNICO,RURAL,73624
