COLE_COD_DANE_ESTABLECIMIENTO,COLE_NOMBRE_ESTABLECIMIENTO,COLE_GENERO,COLE_NATURALEZA,COLE_CARACTER,COLE_AREA_UBICACION,COLE_COD_MCPIO_UBICACION
319001004979,INSTITUTO DE ENSEÑANZA Y CAPACITACION TECNICA DEL CAUCA,MIXTO,NO OFICIAL,ACADÉMICO,URBANO,19001
205790000332,I.E.R. MONTENEGRO,MIXTO,OFICIAL,NO APLICA,RURAL,5790
266383000050,IE PATIO BONITO,MIXTO,OFICIAL,TÉCNICO,RURAL,66383
225594000830,INSTITUCION EDUCATIVA DEPARTAMENTAL TECNICO COMERCIAL PUENTE,MIXTO,OFICIAL,TÉCNICO/ACADÉMICO,RURAL,25594
376001023870,COL FE Y ALEGRIA FRAY LUIS AMIGÓ,MIXTO,NO OFICIAL,TÉCNICO/ACADÉMICO,URBANO,76001
366170001979,COLEGIO COLOMBO BRITANICO,MIXTO,NO OFICIAL,ACADÉMICO,RURAL,66170
247245000982,INSTITUCION EDUCATIVA DEPARTAMENTAL RURAL ENRIQUE QUINTERO JAIMES,MIXTO,OFICIAL,TÉCNICO/ACADÉMICO,RURAL,47245
205101000355,I. E. R. FARALLONES,MIXTO,OFICIAL,ACADÉMICO,RURAL,5101
163001003069,CIUDADELA DE OCCIDENTE,MIXTO,OFICIAL,TÉCNICO/ACADÉMICO,URBANO,63001
305308000520,INSTITUTO PARROQUIAL NUESTRA SEÑORA DE LA PRESENTACION,FEMENINO,NO OFICIAL,ACADÉMICO,URBANO,5308
308758078030,CORPORACION ESPECIALIZADA DE SOLEDAD CES,MIXTO,NO OFICIAL,ACADÉMICO,URBANO,8758
276828000123,IE CRISTOBAL COLON,MIXTO,OFICIAL,TÉCNICO,RURAL,76828
219824000125,I.E. POLINDARA,MIXTO,OFICIAL,TÉCNICO,RURAL,19824
419355000479,I.E. TÉCNICO EMPRESARIAL DE SAN JOSÉ,MIXTO,OFICIAL,TÉCNICO,RURAL,19355
205607000175,I. E. R. DOLORES E ISMAEL RESTREPO,MIXTO,OFICIAL,ACADÉMICO,RURAL,5607
217088000217,INSTITUCION EDUCATIVA EL AGUILA,MIXTO,OFICIAL,ACADÉMICO,RURAL,17088
225288000206,INSTITUTO TECNICO COMERCIAL DE CAPELLANIA,MIXTO,OFICIAL,TÉCNICO,RURAL,25288
213667001271,I.E. DE PLAYITAS,MIXTO,OFICIAL,ACADÉMICO,RURAL,13667
305001003513,INST COLOMBO VENEZOLANO,MIXTO,NO OFICIAL,ACADÉMICO,URBANO,5001
354001004758,GIMNASIO CAMPESTRE COMFAORIENTE,MIXTO,NO OFICIAL,ACADÉMICO,URBANO,54874
268406000250,INSTITUCION EDUCATIVA LA VICTORIA,MIXTO,OFICIAL,ACADÉMICO,RURAL,68406
252835000515,IE. IMBILI CARRETERA,MIXTO,OFICIAL,ACADÉMICO,RURAL,52835
319001004677,COLEGIO INSTITUTO  BOLIVARIANO,MIXTO,NO OFICIAL,ACADÉMICO,URBANO,19001
325286000165,COL PARROQUIAL SANTIAGO APOSTOL,MIXTO,NO OFICIAL,ACADÉMICO,URBANO,25286
305001025576,INST EDUC JUAN SEBASTIAN DE CENSA,MIXTO,NO OFICIAL,ACADÉMICO,URBANO,5001
286320001839,I.E.R. FRANCISCO JOSE DE CALDAS,MIXTO,OFICIAL,TÉCNICO/ACADÉMICO,RURAL,86320
368001000869,COL ACAD NUESTRA SEÑORA DEL ROSARIO,FEMENINO,NO OFICIAL,ACADÉMICO,URBANO,68001
308001073499,COLEGIO JERUSALEM,MIXTO,NO OFICIAL,ACADÉMICO,URBANO,8001
252435000320,INSTITUCION EDUCATIVA AGROPECUARIA SAN JUAN BAUTISTA DE LA SALLE,MIXTO,OFICIAL,TÉCNICO,RURAL,52435
368077000451,INSTITUTO PEDAGOGICO DE COLOMBIA-INSPEDCOL,MIXTO,NO OFICIAL,-,URBANO,68077
352612001093,CENTRO DE EDUCACION PARA ADULTOS ANTONIO RICAURTE,MIXTO,NO OFICIAL,ACADÉMICO,URBANO,52612
252838000893,INSTITUCION EDUCATIVA PROVIDENCIA,MIXTO,OFICIAL,ACADÉMICO,URBANO,52565
386568061015,COLEGIO ANTONIO NARI¥O,MIXTO,NO OFICIAL,TÉCNICO/ACADÉMICO,URBANO,86568
311001033374,COL SUPERIOR DE OCCIDENTE,MIXTO,NO OFICIAL,TÉCNICO,URBANO,11001
311001106002,COL CRISTIANO SEMILLA DE VIDA EDUCACION PARA ADULTOS,MIXTO,NO OFICIAL,ACADÉMICO,URBANO,11001
350001005708,COLEGIO MILITAR ANTONIA SANTOS,MIXTO,NO OFICIAL,ACADÉMICO,URBANO,50001
205631000267,I. E. PRESBITERO ANTONIO BAENA SALAZAR,MIXTO,OFICIAL,ACADÉMICO,RURAL,5631
447980002097,INSTITUCION EDUCATIVA DEPARTAMENTAL JOSE BENITO VIVES DE ANDREIS,MIXTO,OFICIAL,TÉCNICO/ACADÉMICO,RURAL,47980
347001053043,COLEGIO INSTITUTO TECNICO DEL CARIBE,MIXTO,NO OFICIAL,ACADÉMICO,URBANO,47001
241524000382,IE EL JUNCAL,MIXTO,OFICIAL,TÉCNICO/ACADÉMICO,RURAL,41524
305045000988,CORPORACIÓN COLEGIO AMERICANO DE APARTADÓ,MIXTO,NO OFICIAL,ACADÉMICO,URBANO,5045
350001001095,COLEGIO ESPIRITU SANTO,MIXTO,NO OFICIAL,ACADÉMICO,URBANO,50001
205120001435,I. E. GASPAR DE RODAS,MIXTO,OFICIAL,ACADÉMICO,URBANO,5120
205310000354,I. E. R. EL SALTO,MIXTO,OFICIAL,ACADÉMICO,RURAL,5310
313001007872,GIMNASIO CERVANTES DE CARTAGENA,MIXTO,NO OFICIAL,ACADÉMICO,URBANO,13001
311102000132,COL INMACULADO CORAZON DE MARIA,MIXTO,NO OFICIAL,ACADÉMICO,URBANO,11001
250325000241,IE DIVINO NIÑO JESUS,MIXTO,OFICIAL,ACADÉMICO,RURAL,50325
244430002097,INSTITUCION EDUCATIVA SAN RAFAEL DE ALBANIA,MIXTO,OFICIAL,ACADÉMICO,URBANO,44035
397001002438,INSTITUTO TECNICO NUEVA COLOMBIA,MIXTO,NO OFICIAL,TÉCNICO,URBANO,97001
225290001643,INSTITUCION EDUCATIVA MUNICIPAL LUIS CARLOS  GALAN SARMIENTO,MIXTO,OFICIAL,TÉCNICO,RURAL,25290
305376000741,POLITECNICO INTERAMERICANO,MIXTO,NO OFICIAL,ACADÉMICO,URBANO,5376
276233000511,IE EL PALMAR,MIXTO,OFICIAL,TÉCNICO,RURAL,76233
208638000059,INSTITUCION EDUCATIVA SAN JOSE DE AGUADA DE PABLO,MIXTO,OFICIAL,ACADÉMICO,RURAL,8638
325754005412,COLEGIO EL MINUTO DE DIOS CIUDAD VERDE,MIXTO,NO OFICIAL,ACADÉMICO,URBANO,25754
241306000044,IE ESCUELA NORMAL SUPERIOR,MIXTO,OFICIAL,TÉCNICO/ACADÉMICO,RURAL,41306
273319000841,INSTITUCION EDUCATIVA TECNICA ALBERTO CASTILLA,MIXTO,OFICIAL,TÉCNICO/ACADÉMICO,RURAL,73319
311001003483,COL DE NSTRA SRA DEL ROSARIO,FEMENINO,NO OFICIAL,ACADÉMICO,URBANO,11001
311001018693,COL ALEXANDER HUMBOLDT,MIXTO,NO OFICIAL,ACADÉMICO,URBANO,11001
270771011516,INST EDUC JOSE MARIA CORDOBA,MIXTO,OFICIAL,ACADÉMICO,RURAL,70771
217486000791,INSTITUCION EDUCATIVA EL ROBLE,MIXTO,OFICIAL,TÉCNICO,RURAL,17486
205615000397,I. E.  BALTAZAR SALAZAR,MIXTO,OFICIAL,ACADÉMICO,RURAL,5615
225513000776,I.E.R.D. LIMONCITOS,MIXTO,OFICIAL,TÉCNICO/ACADÉMICO,RURAL,25513
352356001421,COLEGIO INSTITUTO EDUCATIVO COLOMBIANO INSECOL,MIXTO,NO OFICIAL,ACADÉMICO,URBANO,52356
268271000271,I.E. SANTA HELENA,MIXTO,OFICIAL,TÉCNICO/ACADÉMICO,RURAL,68271
285250000582,INST TEC EMPRESARIAL DEL NORTE DE CASANARE ITENCA,MIXTO,OFICIAL,TÉCNICO,RURAL,85250
205490001213,I. E. R. EL TOTUMO,MIXTO,OFICIAL,ACADÉMICO,RURAL,5490
318001004077,COLEGIO PEDAGÓGICO DE COLOMBIA,MIXTO,NO OFICIAL,ACADÉMICO,URBANO,18001
308433075646,COORPORACION EDUCATIVA TECNICA DEL CARIBE,MIXTO,NO OFICIAL,TÉCNICO,URBANO,8433
215759000630,INSTITUCION EDUCATIVA RAFAEL GUTIERREZ GIRARDOT,MIXTO,OFICIAL,ACADÉMICO,RURAL,15759
317042001060,INSTITUTO TECNICO DE CAPACITACION EN SISTEMAS,MIXTO,NO OFICIAL,ACADÉMICO,URBANO,17042
350001006992,CENANFO,MIXTO,NO OFICIAL,ACADÉMICO,URBANO,50001
354001012181,I.E. MINUTO DE DIOS - POLICARPA SALAVARRIETA,MIXTO,NO OFICIAL,TÉCNICO/ACADÉMICO,URBANO,54001
205001007735,INST EDUC HECTOR ROGELIO MONTOYA,MIXTO,OFICIAL,TÉCNICO/ACADÉMICO,RURAL,5001
466001005871,COL ANGLOAMERICANO,MIXTO,NO OFICIAL,ACADÉMICO,RURAL,66001
166001004625,IE CIUDAD BOQUIA,MIXTO,OFICIAL,ACADÉMICO,URBANO,66001
252683000085,INSTITUCION EDUCATIVA  JESUS DE PRAGA,MIXTO,OFICIAL,ACADÉMICO,RURAL,52683
205318000302,I.E.R. EZEQUIEL SIERRA,MIXTO,OFICIAL,ACADÉMICO,RURAL,5318
213244000880,INSTITUCION EDUCATIVA MACAYEPOS,MIXTO,OFICIAL,ACADÉMICO,RURAL,13244
218765001299,I.E.R. INDIGENA COEMANI FORTUNATO REALLY,MIXTO,OFICIAL,TÉCNICO/ACADÉMICO,RURAL,18756
220060000018,I. E. NUESTRA SEÑORA DEL CARMEN,MIXTO,OFICIAL,ACADÉMICO,RURAL,20060
225839000911,INSTITUCION EDUCATIVA DEPARTAMENTAL KENNEDY,MIXTO,OFICIAL,ACADÉMICO,RURAL,25839
305440000987,INSTITUTO CORFERRINI,MIXTO,NO OFICIAL,ACADÉMICO,URBANO,5440
325377800008,COL JOSE EUSTASIO RIVERA,MIXTO,NO OFICIAL,ACADÉMICO,RURAL,25377
247318000561,INSTITUCION EDUCATIVA DEPARTAMENTAL DE RICAURTE,MIXTO,OFICIAL,TÉCNICO/ACADÉMICO,RURAL,47318
166594000035,IE SAN ANDRES,MIXTO,OFICIAL,ACADÉMICO,RURAL,66594
220238001315,C.E. EL REPOSO,MIXTO,OFICIAL,ACADÉMICO,RURAL,20238
313836001085,CORPORACION EDUCATIVA LA CONCEPCION,MIXTO,NO OFICIAL,-,URBANO,13836
254874000070,INST EDUCATIVA LA FRONTERA,MIXTO,OFICIAL,TÉCNICO,URBANO,54874
376001016920,LIC PORVENIR,MIXTO,NO OFICIAL,TÉCNICO/ACADÉMICO,URBANO,76001
323162000997,CENTRO EDU LICEO MONTESSORY,MIXTO,NO OFICIAL,ACADÉMICO,URBANO,23162
347189042256,CENTRO SISTEMATIZADO ANDRES BELLO,MIXTO,NO OFICIAL,ACADÉMICO,URBANO,47189
152022000084,INSTITUCION EDUCATIVA NUESTRA SEÑORA DEL PILAR,MIXTO,OFICIAL,ACADÉMICO,RURAL,52022
344874000087,COLEGIO LA SAGRADA FAMILIA,MIXTO,NO OFICIAL,ACADÉMICO,URBANO,44874
273678000384,INSTITUCION EDUCATIVA TECNICA COMERCIAL SAN JUAN BOSCO,MIXTO,OFICIAL,TÉCNICO/ACADÉMICO,RURAL,73678
219824000265,INSTITUCION EDUCATIVA AGROFORESTAL SAN JUAN DE QUINTANA,MIXTO,OFICIAL,TÉCNICO,RURAL,19824
254810000629,INSTITUCION EDUCATIVA FILO EL GRINGO,MASCULINO,OFICIAL,ACADÉMICO,RURAL,54250
325214000241,GIMNASIO JIREH,MIXTO,NO OFICIAL,ACADÉMICO,URBANO,25214
370001003595,INS EDU LICEO MODERNO DEL LITORAL (ANTIGUO LICEO MODERNO DEL LITORAL),MIXTO,NO OFICIAL,ACADÉMICO,URBANO,70001
250606000029,IE FRANCISCO TORRES LEON,MIXTO,OFICIAL,TÉCNICO/ACADÉMICO,RURAL,50606
450606000371,COLEGIO NEIL ARMSTRONG,MIXTO,NO OFICIAL,ACADÉMICO,URBANO,50001
415403000197,I.E.T. AGROINDUSTRIAL CUSAGUI,MIXTO,OFICIAL,TÉCNICO,RURAL,15403
270670007399,INSTITUCION EDUCATIVA INDIGENA LA LUCHA,MIXTO,OFICIAL,ACADÉMICO,RURAL,70670
311279000396,COL PARROQ SAN JOSE DE FONTIBON,MIXTO,NO OFICIAL,ACADÉMICO,URBANO,11001
368001007499,I.E. LÍDERES DEL FUTURO,MIXTO,NO OFICIAL,ACADÉMICO,URBANO,68001
354001000370,COL CALASANZ,MIXTO,NO OFICIAL,ACADÉMICO,URBANO,54001
220001002783,I.E. SAN ISIDRO LABRADOR,MIXTO,OFICIAL,TÉCNICO,RURAL,20001
350001004264,COLEGIO NUESTRA SEÑORA DEL CARMEN,MIXTO,NO OFICIAL,ACADÉMICO,URBANO,50001
315238001699,COLEGIO NUESTRA SEÑORA DE GUADALUPE,MIXTO,NO OFICIAL,NO APLICA,URBANO,15238
219212000690,INSTITUCION EDUCATIVA CARMENCITA CARDONA DE GUTIERREZ,MIXTO,OFICIAL,TÉCNICO,RURAL,19212
276041000371,IE JORGE ISAACS,MIXTO,OFICIAL,ACADÉMICO,RURAL,76041
323001009340,INSTITUTO TECNOLÓGICO COLOMBOAMERICANO,MIXTO,NO OFICIAL,ACADÉMICO,URBANO,23001
244279001415,INSTITUCIÓN EDUCATIVA MAYABANGLOMA,MIXTO,OFICIAL,ACADÉMICO,RURAL,44279
344430004558,I.E. SYSTEM CENTER EDUCACION FORMAL PARA JOVENES Y ADULTOS,MIXTO,NO OFICIAL,ACADÉMICO,URBANO,44430
205674000350,I.E.R. SANTA RITA,MIXTO,OFICIAL,ACADÉMICO,RURAL,5674
276275001461,IE IDEBIC,MIXTO,OFICIAL,TÉCNICO/ACADÉMICO,RURAL,76275
366001000742,COL CALASANZ,MIXTO,NO OFICIAL,ACADÉMICO,URBANO,66001
315759001576,LICEO ANGLO AMERICANO DE SOGAMOSO,MIXTO,NO OFICIAL,ACADÉMICO,URBANO,15759
225035000072,INSTITUCION EDUCATIVA RURAL DEPARTAMENTAL SAN ANTONIO,MIXTO,OFICIAL,ACADÉMICO,RURAL,25035
276109003994,PATRICIO OLAVE ANGULO,MIXTO,OFICIAL,TÉCNICO,RURAL,76109
305001017085,GIMNASIO CAMPESTRE EL TESORO,MIXTO,NO OFICIAL,ACADÉMICO,URBANO,5266
270702000227,INST EDUC TEC AGRO DE ALBANIA,MIXTO,OFICIAL,TÉCNICO,RURAL,70702
347001007289,C0LEGIO CRISTIANO LA ESPERANZA,MIXTO,NO OFICIAL,ACADÉMICO,URBANO,47001
366001004560,COL AMERICANO,MIXTO,NO OFICIAL,ACADÉMICO,URBANO,66001
125086000234,I.E.D. TECNICA AGROPECUARIA JAIME NARVAEZ BELTRAN,MIXTO,OFICIAL,TÉCNICO/ACADÉMICO,RURAL,25086
363001002142,GIMNASIO CONTEMPORÁNEO,MIXTO,NO OFICIAL,ACADÉMICO,URBANO,63001
213760000187,INSTITUCION EDUCATIVA TECNICA AGROPECUARIA FRANCISCO DE PAULA SANTANDER HIGUERETAL,MIXTO,OFICIAL,TÉCNICO/ACADÉMICO,RURAL,13620
244847000453,INSTITUCION ETNOEDUCATIVA INTEGRAN RURAL INTERNADO INDIGENA DE CAMINO VERDE,MIXTO,OFICIAL,ACADÉMICO,RURAL,44847
313001029396,INSTITUCION EDUCATIVA CLEMENTE MANUEL ZABAL,MIXTO,OFICIAL,ACADÉMICO,URBANO,13001
125524000013,INSTITUCION EDUCATIVA DEPARTAMENTAL FRANCISCO JOSE DE CALDAS,MIXTO,OFICIAL,TÉCNICO/ACADÉMICO,URBANO,25524
247001001472,INSTITUCION EDUCATIVO DISTRITAL TECNICA ECOLOGICA LA REVUELTA,MIXTO,OFICIAL,TÉCNICO/ACADÉMICO,RURAL,47001
347001004531,COLEGIO AGUSTIN NIETO CABALLERO,MIXTO,NO OFICIAL,ACADÉMICO,URBANO,47001
223678001090,INST. EDC. GUACHARACAL,MIXTO,OFICIAL,ACADÉMICO,RURAL,23678
205120000391,I. E. PIAMONTE,MIXTO,OFICIAL,ACADÉMICO,RURAL,5120
325754000046,ESCUELA NORMAL SUPERIOR MARIA AUXILIADORA,MIXTO,NO OFICIAL,TÉCNICO/ACADÉMICO,URBANO,25754
168669000438,COLEGIO FRAY JOSE DE LAS CASAS NOVAS,MIXTO,OFICIAL,TÉCNICO/ACADÉMICO,RURAL,68669
363001000247,MARIA INMACULADA,FEMENINO,NO OFICIAL,ACADÉMICO,URBANO,63001
273217000455,INSTITUCION EDUCATIVA TOTARCO DINDE,MIXTO,OFICIAL,ACADÉMICO,RURAL,73217
244430001694,INSTITUCION EDUCATIVA INDÍGENA NO. 2,MIXTO,OFICIAL,ACADÉMICO,RURAL,44430
308001000921,COLEGIO NUESTRA SEÑORA DEL CARMEN,MIXTO,NO OFICIAL,ACADÉMICO,URBANO,8001
205837001880,I.E. SAN VICENTE DEL CONGO,MIXTO,OFICIAL,TÉCNICO/ACADÉMICO,RURAL,5837
352001006278,INST EDUC LUISEG,MIXTO,NO OFICIAL,ACADÉMICO,URBANO,52001
219364000440,INSTITUCION EDUCATIVA DE FORMACION INTEGRAL MARDEN ARNULFO BETANCUR ZONA BAJA,MIXTO,OFICIAL,TÉCNICO,RURAL,19364
405615001180,COLEGIO CAMPESTRE HORIZONTES,MIXTO,NO OFICIAL,ACADÉMICO,RURAL,5615
325286000530,INST DE ENSEÑANZA PERSONALIZADA I.D.E.P,MIXTO,NO OFICIAL,ACADÉMICO,URBANO,25286
368001000729,COL  SAN PEDRO CLAVER,MIXTO,NO OFICIAL,ACADÉMICO,URBANO,68001
323417000279,ESCUELA NORMAL SANTA TERESITA,MIXTO,NO OFICIAL,TÉCNICO/ACADÉMICO,URBANO,23417
366001006741,COL ANGLO COLOMBIANO,MIXTO,NO OFICIAL,ACADÉMICO,URBANO,66001
219821000485,INSTITUCIÓN EDUCATIVA LA PLAYA,MIXTO,OFICIAL,ACADÉMICO,RURAL,19821
247707001424,INSTITUCION EDUCATIVA TECNICA DEPARTAMENTAL DE PINTO GILMA ROYERO SOLANO,MIXTO,OFICIAL,TÉCNICO/ACADÉMICO,URBANO,47720
305001006831,INST MUSICAL DIEGO ECHAVARRIA,MIXTO,NO OFICIAL,ACADÉMICO,URBANO,5001
441001002577,SAN ANTONIO DE ANACONIA,MIXTO,OFICIAL,TÉCNICO/ACADÉMICO,RURAL,41001
305154001722,COLEGIO LOS SAUCES,MIXTO,NO OFICIAL,ACADÉMICO,URBANO,5154
247545000071,INSTITUCION EDUCATIVA DEPARTAMENTAL RURAL SAN JOSE,MIXTO,OFICIAL,TÉCNICO/ACADÉMICO,RURAL,47545
311001001901,COL AMERICANO DE BOGOTA,MIXTO,NO OFICIAL,ACADÉMICO,URBANO,11001
308001001935,COLEGIO DE MARIA AUXILIADORA,FEMENINO,NO OFICIAL,TÉCNICO/ACADÉMICO,URBANO,8001
205051002700,I. E. R. GUADUAL ARRIBA,MIXTO,OFICIAL,ACADÉMICO,RURAL,5051
363001000221,JORGE ISAAC,MIXTO,NO OFICIAL,ACADÉMICO,URBANO,63001
354498002559,CORPORACION PEDAGOGICA COLOMBIANA,MIXTO,NO OFICIAL,ACADÉMICO,URBANO,54498
273411000661,INSTITUCION EDUCATIVA LUIS FLOREZ,MIXTO,OFICIAL,ACADÉMICO,RURAL,73411
220001002805,I.E. RODOLFO CASTRO CASTRO,MIXTO,OFICIAL,ACADÉMICO,RURAL,20001
268547000334,COLEGIO  HOLANDA,MIXTO,OFICIAL,TÉCNICO/ACADÉMICO,RURAL,68547
319455000200,INSTITUCION EDUCATIVA EL ROSARIO,MIXTO,OFICIAL,ACADÉMICO,URBANO,19455
308433000344,COLEGIO EL SOCORRO,MIXTO,NO OFICIAL,ACADÉMICO,URBANO,8433
381736001849,COLEGIO ADVENTISTA BETHEL,MIXTO,NO OFICIAL,ACADÉMICO,URBANO,81736
373001011104,COL COMFATOLIMA,MIXTO,NO OFICIAL,ACADÉMICO,URBANO,73001
252051000691,INSTITUCION EDUCATIVA ECOLOGICA LA COCHA,MIXTO,OFICIAL,TÉCNICO,RURAL,52051
305088001945,I.E. EL NIQUIA DARÍO LONDOÑO CARDONA,MIXTO,NO OFICIAL,ACADÉMICO,URBANO,5088
323001008467,WINDSOR ROYAL SCHOL,MIXTO,NO OFICIAL,ACADÉMICO,URBANO,23001
452001002528,INST EDUC MPAL EL ENCANO,MIXTO,OFICIAL,ACADÉMICO,RURAL,52001
219256000191,I.E. CUATRO ESQUINAS,MIXTO,OFICIAL,ACADÉMICO,RURAL,19256
219473000549,INSTITUCION EDUCATIVA INTERCULTURAL BILING¿E AGUA NEGRA,MIXTO,OFICIAL,ACADÉMICO,RURAL,19473
305631017131,INSTITUTO CORFERRINI,MIXTO,NO OFICIAL,ACADÉMICO,URBANO,5631
285001003873,I.E. LLANO LINDO,MIXTO,OFICIAL,ACADÉMICO,URBANO,85001
220175000747,I.E. LAS VEGAS,MIXTO,OFICIAL,ACADÉMICO,RURAL,20175
311265000954,COL YERMO Y PARRES,FEMENINO,NO OFICIAL,ACADÉMICO,URBANO,11001
368001000826,COL COOP JOSE ACEVEDO Y GOMEZ,MIXTO,NO OFICIAL,ACADÉMICO,URBANO,68001
254720000328,INST. EDUCATIVA MONSE¿OR SARMIENTO PERALTA,MIXTO,OFICIAL,TÉCNICO/ACADÉMICO,RURAL,54720
220787000118,I. E. PUERTO BOCAS,MIXTO,OFICIAL,TÉCNICO/ACADÉMICO,RURAL,20787
225535000010,INSTITUCION EDUCATIVA DEPTAL ADOLFO LEON GOMEZ,MIXTO,OFICIAL,TÉCNICO/ACADÉMICO,RURAL,25535
315176000997,CENTRO DE ENSEÑANZA PRECOZ CAMINO AL SABER,MIXTO,NO OFICIAL,ACADÉMICO,URBANO,15176
241306000958,IE JORGE ELIECER GAITAN,MIXTO,OFICIAL,TÉCNICO,RURAL,41306
368001004198,COLEGIO PSICOPEDAG CARL ROGERS,MIXTO,NO OFICIAL,ACADÉMICO,URBANO,68001
519001000002,CENT EDUCATIVO EMPRESARIAL COMFACAUCA,MIXTO,NO OFICIAL,ACADÉMICO,URBANO,19001
213673000243,INSTITUCION EDUCATIVA ACADEMICA Y TECNICA DE LOMA ARENA,MIXTO,OFICIAL,ACADÉMICO,RURAL,13673
250680000138,IE SIMON BOLIVAR,MIXTO,OFICIAL,TÉCNICO/ACADÉMICO,RURAL,50680
468167000729,INSTITUTO TECNICO PARA EL DESARROLLO RURAL IDEAR,MIXTO,NO OFICIAL,ACADÉMICO,RURAL,68167
186573000354,IE JOSE MARIA HERNANDEZ,MIXTO,OFICIAL,TÉCNICO,URBANO,86573
213673000081,I.E. NUESTRA SEÑORA DEL CARMEN DE LAS CARAS,MIXTO,OFICIAL,ACADÉMICO,RURAL,13222
213780000060,INSTITUCION EDUCATIVA TOMAS DANIELS DE PATICO,MIXTO,OFICIAL,ACADÉMICO,RURAL,13780
308634000113,CORPORACIÓN EDUCATIVA NIÑO JESUS,MIXTO,NO OFICIAL,ACADÉMICO,URBANO,8634
305664000836,INSTITUTO CORFERRINI,MIXTO,NO OFICIAL,ACADÉMICO,URBANO,5664
311001109427,FUNDACIÓN EDUCATIVA PARA LA VIDA  - FUNDESCO,MIXTO,NO OFICIAL,ACADÉMICO,URBANO,11001
273168002277,INSTITUCION EDUCATIVA LA RISALDA,MIXTO,OFICIAL,ACADÉMICO,RURAL,73168
219455000370,INSTITUCION EDUCATIVA TECNICO EL ORTIGAL,MIXTO,OFICIAL,TÉCNICO,RURAL,19455
313001012892,INST. DOCENTE DEL CARIBE,MIXTO,NO OFICIAL,ACADÉMICO,URBANO,13001
354498001188,COL DIOCESANO MONSEÑOR PACHECO,MIXTO,NO OFICIAL,ACADÉMICO,URBANO,54498
313001029868,INSTITUTO EDUCATIVO TECNOCIENCIAS REGIÓN CARIBE,MIXTO,NO OFICIAL,ACADÉMICO,URBANO,13001
313001000541,COL. LA ANUNCIACION,MIXTO,NO OFICIAL,ACADÉMICO,URBANO,13001
213006001649,INSTITUCION EDUCATIVA PLACIDO RETAMOZA,MIXTO,OFICIAL,ACADÉMICO,URBANO,13655
219780011418,I.E. SANTA ROSA DE LIMA,MIXTO,OFICIAL,TÉCNICO,RURAL,19780
205001012534,INST EDUC SAN ANTONIO DE PRADO,MIXTO,OFICIAL,TÉCNICO/ACADÉMICO,URBANO,5001
318001003768,INFORPH,MIXTO,NO OFICIAL,ACADÉMICO,URBANO,18001
311001011460,COLEGIO SAN JOSE DE CALASANZ,MIXTO,NO OFICIAL,ACADÉMICO,URBANO,11001
311001033111,COL MADRE MATILDE,MIXTO,NO OFICIAL,ACADÉMICO,URBANO,11001
311001108862,COLEGIO SAN ANGEL,MIXTO,NO OFICIAL,ACADÉMICO,URBANO,11001
213836000696,CENTRO EDUCATIVO DE AGUAS PRIETAS,MIXTO,OFICIAL,ACADÉMICO,RURAL,13836
244560000321,INST ETNOEDUCATIVA LA GLORIA,MIXTO,OFICIAL,ACADÉMICO,RURAL,44560
297001001046,I.E.D. SAN JAVIER,MIXTO,OFICIAL,ACADÉMICO,RURAL,97001
305088020079,I.E NATACHA Y MICHAEL D,MIXTO,NO OFICIAL,ACADÉMICO,URBANO,5088
368307001869,COGFUCOL,MIXTO,NO OFICIAL,ACADÉMICO,URBANO,68307
311102001015,INST GUIMARC,MIXTO,NO OFICIAL,ACADÉMICO,URBANO,11001
213001001900,I.E. DE ARARCA,MIXTO,OFICIAL,ACADÉMICO,RURAL,13001
219355001212,I.E. PROMOCION SOCIAL GUANACAS,MIXTO,OFICIAL,TÉCNICO,RURAL,19355
205282000602,I. E. LLANO GRANDE,MIXTO,OFICIAL,ACADÉMICO,RURAL,5282
311001105391,COL TECNISISTEMAS SEDE SUBA,MIXTO,NO OFICIAL,ACADÉMICO,URBANO,11001
285001001633,IE EL TRIUNFO,MIXTO,OFICIAL,ACADÉMICO,RURAL,85001
150001007841,IE MARCO ANTONIO FRANCO,MIXTO,OFICIAL,-,URBANO,50001
325513001254,COLEGIO CORAZÓN DE JESÚS,MIXTO,NO OFICIAL,ACADÉMICO,URBANO,25513
213001009056,I.E. NUESTRA SEÑORA DEL BUEN AIRE,MIXTO,OFICIAL,ACADÉMICO,RURAL,13001
368077000299,COLEGIO MARIA MONTESSORI,MIXTO,NO OFICIAL,ACADÉMICO,URBANO,68077
268307000213,INSTITUTO MIGUEL SANCHEZ HINESTROZA,MIXTO,OFICIAL,ACADÉMICO,RURAL,68307
195001002843,I.E. MANUELA BELTRAN,MIXTO,OFICIAL,ACADÉMICO,URBANO,95001
250001003310,INSTITUCI¿N EDUCATIVA ALFONSO L¿PEZ PUMAREJO,MIXTO,OFICIAL,TÉCNICO/ACADÉMICO,RURAL,50001
315001003483,CENTRO EDUCATIVO JUAN DE LA SALLE,MIXTO,NO OFICIAL,ACADÉMICO,URBANO,15001
376111032254,INST PARA EL DESARROLLO HUMANO INTEGRAL - IDHI,MIXTO,NO OFICIAL,TÉCNICO/ACADÉMICO,URBANO,76111
113673000028,INSTITUCI¿N EDUCATIVA T¿CNICA AGROPECUARIA SOSTENIBLE Y AMBIENTAL  FELIPE SANTIAGO ESCOBAR,MIXTO,OFICIAL,TÉCNICO,URBANO,13673
205686000011,C. E. R. HERMINIA YEPES CORREA,MIXTO,OFICIAL,NO APLICA,RURAL,5887
341524001146,COLEGIO ATENEO AUTONOMO,MIXTO,NO OFICIAL,ACADÉMICO,URBANO,41524
347001005570,INSTITUTO LAS AMERICAS,MIXTO,NO OFICIAL,ACADÉMICO,URBANO,47001
250150000129,IE SAN LORENZO,MIXTO,OFICIAL,ACADÉMICO,RURAL,50150
225328000051,INSTITUCION EDUCATIVA DEPARTAMENTAL EL TRIGO,MIXTO,OFICIAL,ACADÉMICO,RURAL,25328
223189001656,IE PIJIGUAYAL,MIXTO,OFICIAL,ACADÉMICO,RURAL,23189
205665000517,I. E. R. ANTONIO NARIÑO,MIXTO,OFICIAL,ACADÉMICO,RURAL,5665
213244001070,I.E. TECNICA AGROPECUARIA MAMON DE MARIA,MIXTO,OFICIAL,TÉCNICO,RURAL,13244
447001050839,INSTITUCION EDUCATIVO DISTRITAL DE PALOMINITO,MIXTO,OFICIAL,ACADÉMICO,RURAL,47001
347001003895,GIMNASIO BOLIVARIANO,MIXTO,NO OFICIAL,ACADÉMICO,URBANO,47001
223670000086,INSTITUCION EDUCATIVA BARBACOA,MIXTO,OFICIAL,ACADÉMICO,RURAL,23815
313001001050,COL. BIFFI,FEMENINO,NO OFICIAL,ACADÉMICO,URBANO,13001
311001008990,COL SUPERIOR AMERICANO,MIXTO,NO OFICIAL,ACADÉMICO,URBANO,11001
308758002017,INSTITUCION EDUCATIVA TECNICA MANUELA BELTRAN,MIXTO,OFICIAL,TÉCNICO,URBANO,8758
325754001221,COLEGIO RICAURTE DE SOACHA,MIXTO,NO OFICIAL,ACADÉMICO,URBANO,25754
205440000798,I. E. R. MARIA DEL ROSARIO,MIXTO,OFICIAL,NO APLICA,RURAL,5440
283247000641,I.E R. SIMON BOLIVAR,MIXTO,OFICIAL,TÉCNICO/ACADÉMICO,RURAL,18247
376400000786,INST TEC DIVERSIFICADO GRAJALES,MIXTO,NO OFICIAL,TÉCNICO,URBANO,76400
223182000620,IE JOSE MARIA CARBONELL,MIXTO,OFICIAL,ACADÉMICO,RURAL,23182
225743000619,INSTITUCIÓN EDUCATIVA RURAL DEPARTAMENTAL AGUABONITA,MIXTO,OFICIAL,TÉCNICO/ACADÉMICO,RURAL,25743
270429003561,I.E. ZAPATA,MIXTO,OFICIAL,ACADÉMICO,RURAL,70429
325754005129,GIMNASIO MODERNO LOS CEDROS,MIXTO,NO OFICIAL,ACADÉMICO,URBANO,25754
305266000508,COLEGIO DE LA PRESENTACION - ENVIGADO,FEMENINO,NO OFICIAL,ACADÉMICO,URBANO,5266
373449000723,GIMNASIO PERSONALIZADO LOS PILARES,MIXTO,NO OFICIAL,ACADÉMICO,URBANO,73449
370708000762,COLEGIO MARIA AUXILIADORA,MIXTO,NO OFICIAL,ACADÉMICO,URBANO,70708
317001007002,INST.EDUC CONTINUA CONFAMILIARES SEDE A,MIXTO,NO OFICIAL,ACADÉMICO,URBANO,17001
220614000015,I. E. EL CAMPAMENTO,MIXTO,OFICIAL,ACADÉMICO,RURAL,20614
305837004565,COL. EL CARMELO CONURABA,MIXTO,NO OFICIAL,ACADÉMICO,URBANO,5837
305736000437,INSTITUTO PARROQUIAL PBRO. JORGE MIRA BALBIN,MIXTO,NO OFICIAL,ACADÉMICO,URBANO,5736
354001007480,COL RAFAEL NU¥EZ,MIXTO,NO OFICIAL,ACADÉMICO,URBANO,54001
386568061022,COL SEMIPRESENCIAL SAN JUAN BOSCO,MIXTO,NO OFICIAL,ACADÉMICO,URBANO,86568
305615001703,INSTITUCION EDUCATIVA JUAN SEBASTIAN DE CENSA,MIXTO,NO OFICIAL,ACADÉMICO,URBANO,5615
217433000578,INSTITUCION EDUCATIVA JOSE ANTONIO GALAN,MIXTO,OFICIAL,ACADÉMICO,RURAL,17433
368547001939,CORPORACION TECNICA CEDEFOC,MIXTO,NO OFICIAL,ACADÉMICO,URBANO,68547
323001008988,POLITECNICO DEL SINÚ,MIXTO,NO OFICIAL,ACADÉMICO,URBANO,23001
263690000084,BOQUIA,MIXTO,OFICIAL,ACADÉMICO,RURAL,63690
273217000315,INSTITUCION EDUCATIVA EL PALMAR,MIXTO,OFICIAL,NO APLICA,RURAL,73217
247692000434,INSTITUCION EDUCATIVA DEPARTAMENTAL DE LA PACHA,MIXTO,OFICIAL,TÉCNICO/ACADÉMICO,RURAL,47692
223001004432,INSTITUCION EDUCATIVA CAMILO TORRES MOCARI,MIXTO,OFICIAL,ACADÉMICO,URBANO,23001
325754003312,COLEGIO MILITAR ALMIRANTE PADILLA,MIXTO,NO OFICIAL,ACADÉMICO,URBANO,25754
208832000141,INSTITUCION EDUCATIVA PLAYA MENDOZA,MIXTO,OFICIAL,ACADÉMICO,RURAL,8832
286568005610,I. E. RUR CAUCACIA,MIXTO,OFICIAL,ACADÉMICO,RURAL,86568
325754003134,INSTITUTO PEDAGOGICO NUEVA GENERACION,MIXTO,NO OFICIAL,NO APLICA,URBANO,25754
217272000131,INSTITUCION EDUCATIVA ANTONIO NARIÑO,MIXTO,OFICIAL,ACADÉMICO,RURAL,17272
305308000791,C.E.  NEOSISTEMAS,MIXTO,NO OFICIAL,ACADÉMICO,URBANO,5308
325430000205,COLEGIO SAGRADOS CORAZONES,FEMENINO,NO OFICIAL,ACADÉMICO,URBANO,25430
405045001334,I.E. CAMPO ALEGRE,MIXTO,OFICIAL,ACADÉMICO,URBANO,5045
205837000280,I.E. RIO GRANDE,MIXTO,OFICIAL,TÉCNICO/ACADÉMICO,RURAL,5837
325754001778,BACHILLERATO TECNICO COMERCIAL SANTA ANA,MIXTO,NO OFICIAL,ACADÉMICO,URBANO,25754
263470000270,MARCO FIDEL SUAREZ,MIXTO,OFICIAL,TÉCNICO/ACADÉMICO,RURAL,63470
311001008680,INST TEC IND CENTRO DON BOSCO,MASCULINO,NO OFICIAL,TÉCNICO,URBANO,11001
252786000041,INSTITUCION EDUCATIVA EL PARAMO,MIXTO,OFICIAL,TÉCNICO/ACADÉMICO,RURAL,52786
363001001952,RAFAEL POMBO,MIXTO,NO OFICIAL,ACADÉMICO,URBANO,63001
305088002631,COL PARROQUIAL JUAN PABLO II,MIXTO,NO OFICIAL,ACADÉMICO,URBANO,5088
305237000256,COLEGIO REINALDO ARROYAVE LOPERA,MIXTO,NO OFICIAL,ACADÉMICO,URBANO,5237
254820001003,CENT EDUC RUR LA CAPILLA,MIXTO,OFICIAL,ACADÉMICO,RURAL,54820
368679000478,LICEO SUPERIOR RAFAEL POMBO,MIXTO,NO OFICIAL,NO APLICA,URBANO,68679
318001000152,CORP EDUC AMIGOS INSTITUTO JEAN PIAGET,MIXTO,NO OFICIAL,ACADÉMICO,URBANO,18001
323001004178,GIMN VALLE GRANDE,MIXTO,NO OFICIAL,ACADÉMICO,URBANO,23001
268167000064,INSTITUCION EDUCATIVA EL RESGUARDO,MIXTO,OFICIAL,ACADÉMICO,RURAL,68167
186865003745,IE CIUDAD LA HORMIGA,MIXTO,OFICIAL,TÉCNICO/ACADÉMICO,URBANO,86865
350001000871,COL NRA SRA DE LA SABIDURIA,MIXTO,NO OFICIAL,ACADÉMICO,URBANO,50001
223555000901,INST.EDUC.ANTONIO RICAURTE,MIXTO,OFICIAL,ACADÉMICO,RURAL,23555
320001006775,COLEGIO COMFACESAR RODOLFO CAMPO SOTO,MIXTO,NO OFICIAL,ACADÉMICO,URBANO,20001
366170001791,INSTITUTO PEDAGOGICO HORIZONTES,MIXTO,NO OFICIAL,ACADÉMICO,URBANO,66170
223675000921,INSTITUCION EDUCATIVA CAMINO REAL,MIXTO,OFICIAL,ACADÉMICO,RURAL,23675
366001005434,INSTITUTO COMFAMILIAR,MIXTO,NO OFICIAL,ACADÉMICO,URBANO,66001
352001006677,I.E. SIMÓN BOLÍVAR,MIXTO,NO OFICIAL,-,URBANO,52001
315238000794,COLEGIO JESUS EUCARISTIA,MIXTO,NO OFICIAL,ACADÉMICO,URBANO,15238
313001006639,INST. SOLEDAD VIVES DE JOLI (ANTES J. I LOS CAPULLITOS),MIXTO,NO OFICIAL,ACADÉMICO,URBANO,13001
223417001629,INST EDUC EL CARMEN,MIXTO,OFICIAL,ACADÉMICO,URBANO,23300
452838000302,I.E. SANTANDER,MIXTO,OFICIAL,TÉCNICO,RURAL,52838
213212000021,I.E.T.A. LUIS VILLAFAÑE PAREJA,MIXTO,OFICIAL,TÉCNICO,RURAL,13212
223417001793,INSTITUCION EDUCATIVA LA UNION,MIXTO,OFICIAL,ACADÉMICO,RURAL,23417
217486000651,INSTITUCION EDUCATIVA PUEBLO RICO,MIXTO,OFICIAL,TÉCNICO,RURAL,17486
286568000472,I.E.R. NUEVA GRANADA,MIXTO,OFICIAL,TÉCNICO/ACADÉMICO,RURAL,86568
313001001068,COL. EUCARISTICO DE SANTA TERESA,FEMENINO,NO OFICIAL,ACADÉMICO,URBANO,13001
325754001841,LICEO PEDAGOGICO CUNDINAMARCA,MIXTO,NO OFICIAL,ACADÉMICO,URBANO,25754
363001000255,SANTA MARIA MICAELA,FEMENINO,NO OFICIAL,TÉCNICO,URBANO,63001
