COLE_COD_DANE_ESTABLECIMIENTO,COLE_NOMBRE_ESTABLECIMIENTO,COLE_GENERO,COLE_NATURALEZA,COLE_CARACTER,COLE_AREA_UBICACION,COLE_COD_MCPIO_UBICACION
176834000351,INSTITUCION EDUCATIVA CORAZON DEL VALLE,MIXTO,OFICIAL,TÉCNICO/ACADÉMICO,URBANO,76834
308001008352,INSTITUCION EDUCATIVA DISTRITAL GOLDA MEIR,MIXTO,OFICIAL,ACADÉMICO,,8001
223555000102,INSTITUCION EDUCATIVA PLAZA BONITA,MIXTO,OFICIAL,ACADÉMICO,,23555
123001001871,INSTITUCION EDUCATIVA JUAN XXIII,MIXTO,OFICIAL,ACADÉMICO,URBANO,23001
150001001860,COLEGIO DEPARTAMENTAL LA ESPERANZA,MIXTO,OFICIAL,TÉCNICO/ACADÉMICO,URBANO,50001
308001010136,LICEO LOS COMUNEROS,MIXTO,NO OFICIAL,ACADÉMICO,URBANO,8001
173349000026,INSTITUCION EDUCATIVA TECNICA ALFONSO PALACIO RUDAS,MIXTO,OFICIAL,TÉCNICO,URBANO,73349
105001000132,INST EDUC JOSE MARIA BERNAL,MIXTO,OFICIAL,ACADÉMICO,URBANO,5001
105001000001,INST EDUC JOSE MARIA VELAZ,MIXTO,OFICIAL,ACADÉMICO,URBANO,5001
105001003425,INST EDUC JOSE MARIA BRAVO MARQUEZ,MIXTO,OFICIAL,ACADÉMICO,URBANO,5001
105001000141,INST EDUC CAMILO TORRES RESTREPO,MIXTO,OFICIAL,ACADÉMICO,URBANO,5001
105001019925,INST EDUC ALCALDIA DE MEDELLIN,MIXTO,OFICIAL,TÉCNICO/ACADÉMICO,URBANO,5001
105001000043,INST EDUC BARRIO SANTA CRUZ,MIXTO,OFICIAL,ACADÉMICO,URBANO,5001
105001001023,INST EDUC ANTONIO RICAURTE,MIXTO,OFICIAL,ACADÉMICO,URBANO,5001
105001019330,INST EDUC BARRIO SANTA MARGARITA,MIXTO,OFICIAL,TÉCNICO/ACADÉMICO,URBANO,5001
105001010588,INST EDUC FE Y ALEGRIA LA CIMA,MIXTO,OFICIAL,TÉCNICO/ACADÉMICO,URBANO,5001
105001001252,INST EDUC CRISTOBAL COLON,MIXTO,OFICIAL,ACADÉMICO,URBANO,5001
105001023965,INST EDUC FINCA LA MESA,MIXTO,OFICIAL,ACADÉMICO,URBANO,5001
105001000981,INST EDUC GILBERTO ALZATE AVENDA?O,MIXTO,OFICIAL,TÉCNICO/ACADÉMICO,URBANO,5001
105001000493,INST EDUC RAMON GIRALDO CEBALLOS,MIXTO,OFICIAL,ACADÉMICO,URBANO,5001
105001011690,INST EDUC FEDERICO CARRASQUILLA,MIXTO,OFICIAL,TÉCNICO/ACADÉMICO,URBANO,5001
105001000167,COL LA PASTORA-EN ADMINISTRACION (AC),MIXTO,NO OFICIAL,TÉCNICO/ACADÉMICO,URBANO,5001
105001008249,INST EDUC BELLO HORIZONTE,MIXTO,OFICIAL,ACADÉMICO,URBANO,5001
105001000175,INST EDUC GABRIEL RESTREPO MORENO,MIXTO,OFICIAL,TÉCNICO/ACADÉMICO,URBANO,5001
105001014851,INST EDUC JESUS REY,MIXTO,OFICIAL,TÉCNICO/ACADÉMICO,URBANO,5001
305001015686,INST EDUC MAESTRO ARENAS BETANCUR,MIXTO,OFICIAL,ACADÉMICO,URBANO,5001
105001000205,INST EDUC SAN AGUSTIN,MIXTO,OFICIAL,ACADÉMICO,URBANO,5001
105001010448,INST EDUC LA ESPERANZA,MIXTO,OFICIAL,TÉCNICO/ACADÉMICO,URBANO,5001
105001002895,INST EDUC FRANCISCO ANTONIO ZEA,MIXTO,OFICIAL,ACADÉMICO,URBANO,5001
105001012165,INST EDUC GUADALUPE,MIXTO,OFICIAL,TÉCNICO/ACADÉMICO,URBANO,5001
105001000256,INST EDUC HECTOR ABAD GOMEZ,MIXTO,OFICIAL,TÉCNICO/ACADÉMICO,URBANO,5001
105001011631,INST EDUC ASAMBLEA DEPARTAMENTAL,MIXTO,OFICIAL,TÉCNICO/ACADÉMICO,URBANO,5001
105001013340,INST EDUC INEM JOSE FELIX DE RESTREPO,MIXTO,OFICIAL,TÉCNICO/ACADÉMICO,URBANO,5001
105001009709,INST EDUC FELIX HENAO BOTERO,MIXTO,OFICIAL,TÉCNICO/ACADÉMICO,URBANO,5001
105001001279,INST EDUC CIRO MENDIA,MIXTO,OFICIAL,ACADÉMICO,URBANO,5001
105001000353,INST EDUC JUAN DE LA CRUZ POSADA,MIXTO,OFICIAL,ACADÉMICO,URBANO,5001
105001000868,INST EDUC REPUBLICA DE VENEZUELA,MIXTO,OFICIAL,ACADÉMICO,URBANO,5001
105001019062,INST EDUC ALFONSO MORA NARANJO,MIXTO,OFICIAL,ACADÉMICO,URBANO,5001
105001000396,INST EDUC JOSE ACEVEDO Y GOMEZ,MIXTO,OFICIAL,TÉCNICO/ACADÉMICO,URBANO,5001
105001000418,INST EDUC LA MILAGROSA,MIXTO,OFICIAL,TÉCNICO/ACADÉMICO,URBANO,5001
105001000485,INST EDUC LA SALLE DE CAMPOAMOR,MIXTO,OFICIAL,TÉCNICO/ACADÉMICO,URBANO,5001
105001001562,INST EDUC JAVIERA LONDO?O,MIXTO,OFICIAL,TÉCNICO/ACADÉMICO,URBANO,5001
105001000990,INST EDUC GONZALO RESTREPO JARAMILLO,FEMENINO,OFICIAL,TÉCNICO/ACADÉMICO,URBANO,5001
105001000566,INST EDUC CARACAS,MIXTO,OFICIAL,ACADÉMICO,URBANO,5001
105001010855,INST EDUC  ANA DE CASTRILLON,MIXTO,OFICIAL,ACADÉMICO,URBANO,5001
105001000621,INST EDUC ESCUELA NORMAL SUPERIOR DE MEDELLIN,MIXTO,OFICIAL,TÉCNICO/ACADÉMICO,URBANO,5001
105001003298,INST EDUC LORENZA VILLEGAS DE SANTOS,FEMENINO,OFICIAL,TÉCNICO/ACADÉMICO,URBANO,5001
105001002526,INST EDUC SAMUEL BARRIENTOS RESTREPO,MIXTO,OFICIAL,TÉCNICO/ACADÉMICO,URBANO,5001
105001002470,INST EDUC SAN VICENTE DE PAUL,MIXTO,OFICIAL,ACADÉMICO,URBANO,5001
105001000795,INST EDUC ALFREDO COCK ARANGO,MIXTO,OFICIAL,TÉCNICO,URBANO,5001
105001000809,INST EDUC PERPETUO SOCORRO,MIXTO,OFICIAL,TÉCNICO/ACADÉMICO,URBANO,5001
105001001848,INST EDUC SOR JUANA INES DE LA CRUZ,MIXTO,OFICIAL,TÉCNICO/ACADÉMICO,URBANO,5001
105001002020,INST EDUC RAFAEL URIBE URIBE,MIXTO,OFICIAL,ACADÉMICO,URBANO,5001
105001000841,INST EDUC JESUS MARIA - EL ROSAL,FEMENINO,OFICIAL,TÉCNICO/ACADÉMICO,URBANO,5001
105001002101,INSTITUCIÓN EDUCATIVA JUAN DE DIOS COCK,MIXTO,OFICIAL,ACADÉMICO,URBANO,5001
105001002119,I.E. MARCO FIDEL SUAREZ,MIXTO,OFICIAL,TÉCNICO/ACADÉMICO,URBANO,5001
105001000876,I.E. JAVIERA LONDOÑO-SEVILLA,MIXTO,OFICIAL,ACADÉMICO,URBANO,5001
105001002305,INST EDUC MARISCAL ROBLEDO,MIXTO,OFICIAL,ACADÉMICO,URBANO,5001
105001006980,INST EDUC CONCEJO DE MEDELLIN,MIXTO,OFICIAL,TÉCNICO/ACADÉMICO,URBANO,5001
105001001121,INST EDUC JOSE ROBERTO VASQUEZ,MIXTO,OFICIAL,TÉCNICO/ACADÉMICO,URBANO,5001
105001003387,INST EDUC SANTA ROSA DE LIMA,MIXTO,OFICIAL,ACADÉMICO,URBANO,5001
105001017965,INST EDUC MANUEL JOSE GOMEZ S,MIXTO,OFICIAL,ACADÉMICO,URBANO,5001
105001000931,INST EDUC DIEGO ECHAVARRIA MISAS,MIXTO,OFICIAL,TÉCNICO/ACADÉMICO,URBANO,5001
105001011070,INST EDUC MERCEDITAS GOMEZ MARTINEZ,MIXTO,OFICIAL,TÉCNICO/ACADÉMICO,URBANO,5001
105001003280,INST EDUC MARIA MONTESSORI,MIXTO,OFICIAL,TÉCNICO/ACADÉMICO,URBANO,5001
105001005525,INST EDUC ENRIQUE OLAYA HERRERA,MIXTO,OFICIAL,ACADÉMICO,URBANO,5001
105001005878,INST EDUC FRANCISCO MIRANDA,MIXTO,OFICIAL,ACADÉMICO,URBANO,5001
105001012700,INST EDUC SAN PABLO,MIXTO,OFICIAL,ACADÉMICO,URBANO,5001
105001001163,INSTITUCION EDUCATIVA LA ASUNCION,MIXTO,OFICIAL,ACADÉMICO,URBANO,5001
105001001155,INST EDUC SAN JUAN BAUTISTA DE LA SALLE,MIXTO,OFICIAL,TÉCNICO/ACADÉMICO,URBANO,5001
105001007188,INST EDUC BENEDIKTA ZUR NIEDEN,MIXTO,OFICIAL,ACADÉMICO,URBANO,5001
105001001198,INST EDUC AURES,MIXTO,OFICIAL,TÉCNICO/ACADÉMICO,URBANO,5001
105001001236,I.E. MONTECARLO GUILLERMO GAVIRIA CORREA,MIXTO,OFICIAL,TÉCNICO/ACADÉMICO,URBANO,5001
105001007978,INST EDUC PABLO NERUDA,MIXTO,OFICIAL,ACADÉMICO,URBANO,5001
105001001317,INST EDUC MADRE MARIA MAZARELLO,FEMENINO,OFICIAL,ACADÉMICO,URBANO,5001
105001019194,INST EDUC EL PEDREGAL,MIXTO,OFICIAL,TÉCNICO/ACADÉMICO,URBANO,5001
105001001368,INST EDUC ALVARO MARIN VELASCO,MIXTO,OFICIAL,ACADÉMICO,URBANO,5001
105001001473,INST EDUC MANUELA BELTRAN,MIXTO,OFICIAL,ACADÉMICO,URBANO,5001
105001001490,INST EDUC LOLA GONZALEZ,MIXTO,OFICIAL,TÉCNICO/ACADÉMICO,URBANO,5001
105001001805,INST EDUC FE Y ALEGRIA POPULAR NRO. 1,MIXTO,OFICIAL,TÉCNICO/ACADÉMICO,URBANO,5001
105001005339,INST EDUC MONSE?OR FRANCISCO CRISTOBAL TORO,MIXTO,OFICIAL,TÉCNICO/ACADÉMICO,URBANO,5001
105001001635,INST EDUC YERMO Y PARRES,MIXTO,OFICIAL,TÉCNICO/ACADÉMICO,URBANO,5001
105001001651,INST EDUC JOSE CELESTINO MUTIS,MIXTO,OFICIAL,ACADÉMICO,URBANO,5001
105001001660,INST EDUC JOSE ANTONIO GALAN,MIXTO,OFICIAL,ACADÉMICO,URBANO,5001
105001006068,INST EDUC DINAMARCA,MIXTO,OFICIAL,ACADÉMICO,URBANO,5001
105001011886,INST EDUC AMERICA,MIXTO,OFICIAL,ACADÉMICO,URBANO,5001
105001001716,INSTITUCION EDUCATIVA SANTA CATALINA DE SIENA,MIXTO,OFICIAL,ACADÉMICO,URBANO,5001
105001002071,I.E. BENJAMIN HERRERA,MIXTO,OFICIAL,TÉCNICO/ACADÉMICO,URBANO,5001
105001001791,INST EDUC MONSEÑOR GERARDO VALENCIA CANO,MIXTO,OFICIAL,ACADÉMICO,URBANO,5001
105001001821,INST EDUC NUEVO HORIZONTE,MIXTO,OFICIAL,ACADÉMICO,URBANO,5001
105001001881,I.E. CARLOS VIECO ORTIZ,MIXTO,OFICIAL,ACADÉMICO,URBANO,5001
105001002003,INST EDUC SAN ROBERTO BELARMINO,MIXTO,OFICIAL,ACADÉMICO,URBANO,5001
105001002011,INST EDUC FEDERICO OZANAM,MIXTO,OFICIAL,TÉCNICO/ACADÉMICO,URBANO,5001
105001002038,INST EDUC JOSE EUSEBIO CARO,MIXTO,OFICIAL,ACADÉMICO,URBANO,5001
105001002488,INST EDUC PEDRO LUIS VILLA,MIXTO,OFICIAL,TÉCNICO/ACADÉMICO,URBANO,5001
105001002135,INST EDUC RAMON MUNERA LOPERA,MIXTO,OFICIAL,ACADÉMICO,URBANO,5001
105001019089,INST EDUC VIDA PARA TODOS,MIXTO,OFICIAL,ACADÉMICO,URBANO,5001
105001026581,INST EDUC LA SIERRA,MIXTO,OFICIAL,,URBANO,5001
105001015831,INST EDUC VALLEJUELOS,MIXTO,OFICIAL,ACADÉMICO,URBANO,5001
105001026131,I.E. EL PINAL,MIXTO,OFICIAL,ACADÉMICO,URBANO,5001
105001002348,INST EDUC FE Y ALEGRIA SANTO DOMINGO SAVIO,MIXTO,OFICIAL,TÉCNICO/ACADÉMICO,URBANO,5001
105001002356,INST EDUC GABRIEL GARCIA MARQUEZ,MIXTO,OFICIAL,TÉCNICO/ACADÉMICO,URBANO,5001
105001025771,INST EDUC JOAQUIN VALLEJO ARBELAEZ,MIXTO,OFICIAL,TÉCNICO/ACADÉMICO,URBANO,5001
105001012696,INST EDUC ALFONSO LOPEZ PUMAREJO,MIXTO,OFICIAL,ACADÉMICO,URBANO,5001
105001005347,INST EDUC TULIO OSPINA,MIXTO,OFICIAL,TÉCNICO/ACADÉMICO,URBANO,5001
105001002461,INST EDUC LUCRECIO JARAMILLO VELEZ,MIXTO,OFICIAL,ACADÉMICO,URBANO,5001
105001003123,I.E. FATIMA NUTIBARA,MIXTO,OFICIAL,TÉCNICO/ACADÉMICO,URBANO,5001
105001002496,INST EDUC CRISTO REY,MIXTO,OFICIAL,TÉCNICO/ACADÉMICO,URBANO,5001
105001020028,INST EDUC EL SALVADOR,MIXTO,OFICIAL,TÉCNICO/ACADÉMICO,URBANO,5001
105001002780,INST EDUC SAN FRANCISCO DE ASIS,MIXTO,OFICIAL,TÉCNICO/ACADÉMICO,URBANO,5001
105001002798,INST EDUC MATER DEI,MIXTO,OFICIAL,ACADÉMICO,URBANO,5001
105001006718,INST EDUC ASIA IGNACIANA,MIXTO,OFICIAL,TÉCNICO/ACADÉMICO,URBANO,5001
105001019798,INST EDUC ALFONSO LOPEZ,MIXTO,OFICIAL,ACADÉMICO,URBANO,5001
105001002976,INST EDUC LA PIEDAD,MIXTO,OFICIAL,ACADÉMICO,URBANO,5001
105001003131,INST EDUC REPUBLICA DE HONDURAS,MIXTO,OFICIAL,ACADÉMICO,URBANO,5001
105001019453,INST EDUC VILLA DEL SOCORRO,MIXTO,OFICIAL,TÉCNICO/ACADÉMICO,URBANO,5001
105001003221,INSTITUCION EDUCATIVA MANUEL JOSE CAYZEDO,MIXTO,OFICIAL,TÉCNICO/ACADÉMICO,URBANO,5001
105001003271,INSTITUCION EDUCATIVA OCTAVIO HARRY - JACQUELINE KENNEDY,MIXTO,OFICIAL,TÉCNICO/ACADÉMICO,URBANO,5001
105001003450,INST EDUC ROSALIA SUAREZ,MIXTO,OFICIAL,ACADÉMICO,URBANO,5001
105001003441,INS TEC INDUSTRIAL PASCUAL BRAVO,MIXTO,OFICIAL,TÉCNICO/ACADÉMICO,URBANO,5001
105001004472,INST EDUC LA PRESENTACION,FEMENINO,OFICIAL,ACADÉMICO,URBANO,5001
105001004791,INST EDUC SANTO ANGEL,FEMENINO,OFICIAL,ACADÉMICO,URBANO,5001
105001005291,INST EDUC CAMPO VALDES,MIXTO,OFICIAL,ACADÉMICO,URBANO,5001
105001013072,INST EDUC MAESTRO PEDRO NEL GOMEZ,MIXTO,OFICIAL,ACADÉMICO,URBANO,5001
105001005380,I.E. MANUEL URIBE ÁNGEL,MIXTO,OFICIAL,ACADÉMICO,URBANO,5001
105001005410,INST EDUC JUAN DE DIOS CARVAJAL,MIXTO,OFICIAL,TÉCNICO/ACADÉMICO,URBANO,5001
105001009865,INST EDUC HERNAN TORO AGUDELO,MIXTO,OFICIAL,ACADÉMICO,URBANO,5001
105001005495,INST EDUC REPUBLICA DE URUGUAY,MIXTO,OFICIAL,TÉCNICO/ACADÉMICO,URBANO,5001
105001012092,INST EDUC BARRIO SANTANDER,MIXTO,OFICIAL,TÉCNICO/ACADÉMICO,URBANO,5001
105001006092,INST EDUC JULIO CESAR GARCIA,MIXTO,OFICIAL,TÉCNICO/ACADÉMICO,URBANO,5001
105001006181,INST EDUC PEDRO OCTAVIO AMADO,MIXTO,OFICIAL,TÉCNICO/ACADÉMICO,URBANO,5001
105001006246,INST EDUC JORGE ROBLEDO,MIXTO,OFICIAL,ACADÉMICO,URBANO,5001
105001006483,INST EDUC RODRIGO CORREA PALACIO,MIXTO,OFICIAL,TÉCNICO/ACADÉMICO,URBANO,5001
105001021636,INST EDUC KENNEDY,MIXTO,OFICIAL,TÉCNICO/ACADÉMICO,URBANO,5001
105001015172,INST EDUC EDUARDO SANTOS,MIXTO,OFICIAL,TÉCNICO/ACADÉMICO,URBANO,5001
105001006556,INST EDUC JUAN XXIII,MIXTO,OFICIAL,ACADÉMICO,URBANO,5001
105001025844,INST EDUC ANTONIO DERKA - SANTO DOMINGO,MIXTO,OFICIAL,TÉCNICO/ACADÉMICO,URBANO,5001
105001007111,INST EDUC SEBASTIAN DE BELALCAZAR,MIXTO,OFICIAL,ACADÉMICO,URBANO,5001
105001007218,INST EDUC MARIA DE LOS ANGELES CANO MARQUEZ,MIXTO,OFICIAL,TÉCNICO/ACADÉMICO,URBANO,5001
105001025780,INST EDUC PBRO ANTONIO JOSE BERNAL LONDOÑO SJ,MIXTO,OFICIAL,TÉCNICO/ACADÉMICO,URBANO,5001
105001007421,INST EDUC OCTAVIO CALDERON MEJIA,MIXTO,OFICIAL,TÉCNICO/ACADÉMICO,URBANO,5001
105001024073,INST EDUC CASD,MIXTO,OFICIAL,TÉCNICO/ACADÉMICO,URBANO,5001
105001007439,INST EDUC PEDRO CLAVER AGUIRRE,MIXTO,OFICIAL,ACADÉMICO,URBANO,5001
105001010367,INST EDUC SANTOS ANGELES CUSTODIOS,FEMENINO,OFICIAL,TÉCNICO/ACADÉMICO,URBANO,5001
105001007889,INST EDUC JUVENIL NUEVO FUTURO,MIXTO,OFICIAL,ACADÉMICO,URBANO,5001
105001007919,COL SAGRADA FAMILIA ALDEA PABLO VI,MIXTO,NO OFICIAL,ACADÉMICO,URBANO,5001
105001019429,INST EDUC LUIS CARLOS GALAN SARMIENTO,MIXTO,OFICIAL,ACADÉMICO,URBANO,5001
105001026697,INST EDUC FUNDADORES,MIXTO,OFICIAL,,URBANO,5001
105001008389,INST EDUC LORETO-GABRIELA GOMEZ CARVAJAL,MIXTO,OFICIAL,TÉCNICO/ACADÉMICO,URBANO,5001
105001008486,I.E. CAPILLA DEL ROSARIO,MIXTO,OFICIAL,ACADÉMICO,URBANO,5001
105001009652,INST EDUC SAN LORENZO DE ABURRA,MIXTO,OFICIAL,TÉCNICO/ACADÉMICO,URBANO,5001
105001009695,INST EDUC SAN JUAN BOSCO,FEMENINO,OFICIAL,TÉCNICO/ACADÉMICO,URBANO,5001
105001010111,INST EDUC MAESTRO FERNANDO BOTERO,MIXTO,OFICIAL,TÉCNICO/ACADÉMICO,URBANO,5001
105001010928,CENT EDUCAL DON BOSCO,MIXTO,NO OFICIAL,ACADÉMICO,URBANO,5001
105001011011,INST EDUC TOMAS CARRASQUILLA NO. 2,MIXTO,OFICIAL,ACADÉMICO,URBANO,5001
105001011061,INST EDUC JOSE ASUNCION SILVA,MIXTO,OFICIAL,ACADÉMICO,URBANO,5001
105001011088,INST EDUC CIUDADELA LAS AMERICAS,MIXTO,OFICIAL,ACADÉMICO,URBANO,5001
105001011363,INST EDUC DOCE DE OCTUBRE,MIXTO,OFICIAL,TÉCNICO/ACADÉMICO,URBANO,5001
105001016420,INST EDUC TRICENTENARIO,MIXTO,OFICIAL,ACADÉMICO,URBANO,5001
105001011461,INST EDUC FE Y ALEGRIA AURES,MIXTO,OFICIAL,TÉCNICO/ACADÉMICO,URBANO,5001
105001011606,INST EDUC HORACIO MU?OZ SUESCUN,MIXTO,OFICIAL,TÉCNICO/ACADÉMICO,URBANO,5001
105001011711,INST EDUC FE Y ALEGRIA VILLA DE LA CANDELARIA,MIXTO,OFICIAL,TÉCNICO/ACADÉMICO,URBANO,5001
105001012076,ESCUELA UNIVERSIDAD NACIONAL,MIXTO,OFICIAL,NO APLICA,URBANO,5001
105001012106,INST EDUC JUAN MARIA CESPEDES,MIXTO,OFICIAL,TÉCNICO/ACADÉMICO,URBANO,5001
105001012581,INSTITUCION EDUCATIVA REINO DE BELGICA,MIXTO,OFICIAL,ACADÉMICO,URBANO,5001
105001013013,INSTITUCION EDUCATIVA EL PICACHITO,MIXTO,OFICIAL,ACADÉMICO,URBANO,5001
105001013145,INST EDUC SANTA TERESA,MIXTO,OFICIAL,ACADÉMICO,URBANO,5001
105001013633,INST EDUC LOMA HERMOSA,MIXTO,OFICIAL,ACADÉMICO,RURAL,5001
105001013439,INST EDUC FELIX DE BEDOUT MORENO,MIXTO,OFICIAL,TÉCNICO/ACADÉMICO,URBANO,5001
105001013447,INST EDUC JOSE HORACIO BETANCUR,MIXTO,OFICIAL,TÉCNICO/ACADÉMICO,RURAL,5001
105001014397,INST EDUC LUIS LOPEZ DE MESA,MIXTO,OFICIAL,TÉCNICO/ACADÉMICO,URBANO,5001
105001015148,INST EDUC CAMILO MORA CARRASQUILLA,MIXTO,OFICIAL,ACADÉMICO,URBANO,5001
105001015091,INST EDUC FE Y ALEGRIA GRANIZAL,MIXTO,OFICIAL,TÉCNICO/ACADÉMICO,URBANO,5001
105001021199,INST EDUC LA INDEPENDENCIA,MIXTO,OFICIAL,TÉCNICO/ACADÉMICO,URBANO,5001
105001015211,INST EDUC LA LIBERTAD,MIXTO,OFICIAL,ACADÉMICO,URBANO,5001
105001021873,INST EDUC SOL DE ORIENTE,MIXTO,OFICIAL,TÉCNICO/ACADÉMICO,URBANO,5001
105001017132,INST EDUC FE Y ALEGRIA SAN JOSE,MIXTO,OFICIAL,ACADÉMICO,URBANO,5001
105001017876,INST EDUC FRANCISCO LUIS HERNANDEZ BETANCUR,MIXTO,OFICIAL,ACADÉMICO,URBANO,5001
105001026549,INST EDUC BELLO ORIENTE,MIXTO,OFICIAL,,URBANO,5001
105001018759,INST EDUC FE Y ALEGRIA EL LIMONAR,MIXTO,OFICIAL,ACADÉMICO,URBANO,5001
105001019011,I.E. STELLA VELEZ LONDOÑO,MIXTO,OFICIAL,TÉCNICO/ACADÉMICO,URBANO,5001
105001019143,I.E. JORGE ELIECER GAITAN,MIXTO,OFICIAL,TÉCNICO/ACADÉMICO,URBANO,5001
105001019534,INST EDUC RODRIGO LARA BONILLA,MIXTO,OFICIAL,ACADÉMICO,URBANO,5001
105001020052,INST EDUC RAFAEL GARCIA HERREROS,MIXTO,OFICIAL,ACADÉMICO,URBANO,5001
105001025992,INST EDUC LA HUERTA,MIXTO,OFICIAL,ACADÉMICO,URBANO,5001
105001019305,INST EDUC LA AVANZADA,MIXTO,OFICIAL,ACADÉMICO,URBANO,5001
105001026689,INST EDUC BLANQUIZAL,MIXTO,OFICIAL,,URBANO,5001
105001800112,INST EDUC EL DIAMANTE,MIXTO,OFICIAL,,URBANO,5001
105034000278,I. E. MARCO FIDEL SUAREZ,MIXTO,OFICIAL,TÉCNICO/ACADÉMICO,URBANO,5034
105038000019,I. E. MARIANO DE JESUS EUSSE,MIXTO,OFICIAL,TÉCNICO/ACADÉMICO,URBANO,5038
105045000601,I.E. CADENA LAS PLAYAS,MIXTO,OFICIAL,ACADÉMICO,URBANO,5045
105001019674,INST EDUC MIRAFLORES - LUIS EDUARDO VALENCIA GARCIA,MIXTO,OFICIAL,ACADÉMICO,URBANO,5001
105045001667,I.E. LA PAZ,MIXTO,OFICIAL,ACADÉMICO,URBANO,5045
105001026361,INSTITUCION EDUCATIVA JESUS MARIA VALLE,MIXTO,OFICIAL,ACADÉMICO,URBANO,5001
105045010721,I.E. SAN JOSÉ OBRERO,MIXTO,OFICIAL,,URBANO,5045
105001020273,INST EDUC CIUDAD DON BOSCO,MIXTO,OFICIAL,TÉCNICO/ACADÉMICO,URBANO,5001
105001021547,INST EDUC VILLA FLORA,MIXTO,OFICIAL,ACADÉMICO,URBANO,5001
105001026603,INST EDUC ALTAVISTA,MIXTO,OFICIAL,,RURAL,5001
105045010780,I.E. SAN JUAN BOSCO,MIXTO,OFICIAL,,URBANO,5045
105001022101,INST EDUC LAS NIEVES,MIXTO,OFICIAL,ACADÉMICO,URBANO,5001
105088000273,IE FERNANDO VELEZ,MIXTO,OFICIAL,ACADÉMICO,URBANO,5088
105088000290,IE DIVINA EUCARISTIA,MIXTO,OFICIAL,ACADÉMICO,URBANO,5088
105088000389,IE SANTA CATALINA,MIXTO,OFICIAL,ACADÉMICO,URBANO,5088
105172000220,I. E. MARIA AUXILIADORA,MIXTO,OFICIAL,ACADÉMICO,URBANO,5172
105197000160,I. E. COCORNA,MIXTO,OFICIAL,ACADÉMICO,URBANO,5197
105001025763,INST EDUC DEBORA ARANGO PEREZ,MIXTO,OFICIAL,TÉCNICO/ACADÉMICO,URBANO,5001
105001025798,INST EDUC ANGELA RESTREPO MORENO,MIXTO,OFICIAL,ACADÉMICO,URBANO,5001
105001025984,I.E. COLEGIO LOYOLA PARA LA CIENCIA Y LA INNOVACIÓN,MIXTO,OFICIAL,TÉCNICO/ACADÉMICO,URBANO,5001
105001026671,INST EDUC SAN NICOLAS,MIXTO,OFICIAL,,URBANO,5001
105001026000,INST EDUC CIUDADELA NUEVO OCCIDENTE,MIXTO,OFICIAL,ACADÉMICO,URBANO,5001
205001006526,INST EDUC MARINA ORTH,MIXTO,OFICIAL,ACADÉMICO,RURAL,5001
105001026352,INSTITUCION EDUCATIVA EL CORAZÓN,MIXTO,OFICIAL,ACADÉMICO,URBANO,5001
105031001583,I. E. PUEBLO NUEVO,MIXTO,OFICIAL,ACADÉMICO,URBANO,5031
105001026654,INST EDUC EL PLAYON,MIXTO,OFICIAL,,URBANO,5001
105042000180,I. E. SAN LUIS GONZAGA,MIXTO,OFICIAL,ACADÉMICO,URBANO,5042
105001026514,INST EDUC SAN BENITO,MIXTO,OFICIAL,,URBANO,5001
105001026573,IE LUSITANIA- PAZ DE COLOMBIA,MIXTO,OFICIAL,,URBANO,5001
105042000732,I. E. ARTURO VELASQUEZ ORTIZ,MIXTO,OFICIAL,ACADÉMICO,URBANO,5042
105045000164,I.E. MADRE LAURA,MIXTO,OFICIAL,TÉCNICO/ACADÉMICO,URBANO,5045
105001026662,INST EDUC LA PASTORA,MIXTO,OFICIAL,,URBANO,5001
105045000393,I.E. ALFONSO LOPEZ,MIXTO,OFICIAL,ACADÉMICO,URBANO,5045
105002000047,I. E. FUNDACION CELIA DUQUE DE DUQUE,MIXTO,OFICIAL,TÉCNICO/ACADÉMICO,URBANO,5002
105031000056,I. E. PRESBITERO GERARDO MONTOYA,MIXTO,OFICIAL,ACADÉMICO,URBANO,5031
105034000014,I. E. SAN JUAN DE LOS ANDES,MIXTO,OFICIAL,TÉCNICO/ACADÉMICO,URBANO,5034
105002000055,I. E.  MANUEL CANUTO RESTREPO,MIXTO,OFICIAL,TÉCNICO/ACADÉMICO,URBANO,5002
105002000161,I. E. ESCUELA NORMAL SUPERIOR,MIXTO,OFICIAL,TÉCNICO/ACADÉMICO,URBANO,5002
105004000109,I. E.  LA MILAGROSA,MIXTO,OFICIAL,ACADÉMICO,URBANO,5004
105021000139,I. E. PROCESA DELGADO,MIXTO,OFICIAL,ACADÉMICO,URBANO,5021
105030000028,I. E. SAN FERNANDO,MIXTO,OFICIAL,TÉCNICO/ACADÉMICO,URBANO,5030
105030000010,I. E. ESCUELA NORMAL SUPERIOR AMAGA,MIXTO,OFICIAL,TÉCNICO/ACADÉMICO,URBANO,5030
105031001516,I. E. EDUARDO FERNANDEZ BOTERO,MIXTO,OFICIAL,TÉCNICO/ACADÉMICO,URBANO,5031
105045001454,I.E. SAN FRACISCO DE ASIS,MIXTO,OFICIAL,ACADÉMICO,URBANO,5045
105034000740,I. E. JUAN DE DIOS URIBE,MIXTO,OFICIAL,TÉCNICO/ACADÉMICO,URBANO,5034
205034000329,C. E. R. SANTA INES,MIXTO,OFICIAL,NO APLICA,RURAL,5034
105034001207,I. E. MARIA AUXILIADORA,MIXTO,OFICIAL,TÉCNICO/ACADÉMICO,URBANO,5034
105036000097,I. E.  SAN JOSE,MIXTO,OFICIAL,ACADÉMICO,URBANO,5036
105040000212,I. E. ANORI,MIXTO,OFICIAL,TÉCNICO/ACADÉMICO,URBANO,5040
105045000148,I.E. JOSE CELESTINO MUTIS,MIXTO,OFICIAL,ACADÉMICO,URBANO,5045
105044000128,I. E. ANZA,MIXTO,OFICIAL,ACADÉMICO,URBANO,5044
105045000318,I.E. JOSÉ JOAQUIN VÉLEZ,MIXTO,OFICIAL,ACADÉMICO,URBANO,5045
105045001217,I.E. POLICARPA SALAVARRIETA,MIXTO,OFICIAL,ACADÉMICO,URBANO,5045
105045001527,I.E. SANTA MARIA DE LA ANTIGUA,MIXTO,OFICIAL,ACADÉMICO,URBANO,5045
305045001658,I.E. SAN PEDRO CLAVER,MIXTO,OFICIAL,ACADÉMICO,URBANO,5045
105045001683,I. E. HERACLIO MENA PADILLA,MIXTO,OFICIAL,ACADÉMICO,URBANO,5045
105051000028,I. E. MIGUEL VICENTE GARRIDO ORTIZ,MIXTO,OFICIAL,TÉCNICO/ACADÉMICO,URBANO,5051
105051000508,I. E. JOSE MANUEL RESTREPO,MIXTO,OFICIAL,ACADÉMICO,URBANO,5051
105079000082,I. E.  LUIS EDUARDO ARIAS REINEL,MIXTO,OFICIAL,TÉCNICO/ACADÉMICO,URBANO,5079
105088001873,IE CARLOS PEREZ MEJIA,MIXTO,OFICIAL,ACADÉMICO,URBANO,5088
105088001806,IE ALBERTO LEBRUM MUNERA,MIXTO,OFICIAL,TÉCNICO,URBANO,5088
105088001555,IE HERNAN VILLA BAENA,MIXTO,OFICIAL,ACADÉMICO,URBANO,5088
105055000022,I. E. SANTA TERESA,MIXTO,OFICIAL,ACADÉMICO,URBANO,5055
105059000116,I. E. ROSA MESA DE MEJIA,MIXTO,OFICIAL,ACADÉMICO,URBANO,5059
105079000015,I. E. MANUEL JOSE CAICEDO,MIXTO,OFICIAL,TÉCNICO/ACADÉMICO,URBANO,5079
105079000406,I. E. PRESBITERO LUIS EDUARDO PEREZ MOLINA,MIXTO,OFICIAL,TÉCNICO,URBANO,5079
105086000110,I.E. PBRO. RICARDO LUIS GUTIERREZ TOBON,MIXTO,OFICIAL,ACADÉMICO,URBANO,5086
105088001512,I.E. JORGE ELIECER GAITAN,MIXTO,OFICIAL,ACADÉMICO,URBANO,5088
105088002918,IE FONTIDUEÑO JAIME ARANGO ROJAS,MIXTO,OFICIAL,ACADÉMICO,URBANO,5088
105088000338,IE BARRIO PARIS,MIXTO,OFICIAL,ACADÉMICO,URBANO,5088
105088000362,IE CINCUENTENARIO DE FABRICATO,MIXTO,OFICIAL,ACADÉMICO,URBANO,5088
105088000419,IE LA GABRIELA,MIXTO,OFICIAL,ACADÉMICO,URBANO,5088
105088000427,IE SAGRADO CORAZON,MIXTO,OFICIAL,ACADÉMICO,URBANO,5088
105088000486,IE PLAYA RICA,MIXTO,OFICIAL,TÉCNICO,URBANO,5088
105088002829,IE TOMAS CADAVID RESTREPO,MIXTO,OFICIAL,ACADÉMICO,URBANO,5088
105088000877,IE MARCO FIDEL SUAREZ,MIXTO,OFICIAL,ACADÉMICO,URBANO,5088
105088000532,IE LA MILAGROSA,MIXTO,OFICIAL,ACADÉMICO,URBANO,5088
105088002705,IE VILLA DEL SOL,MIXTO,OFICIAL,ACADÉMICO,URBANO,5088
105088002993,IE ALBERTO DIAZ MUÑOZ,MIXTO,OFICIAL,ACADÉMICO,URBANO,5088
105088002691,IE ATANASIO GIRARDOT,MIXTO,OFICIAL,TÉCNICO/ACADÉMICO,URBANO,5088
105088001415,IE ABRAHAM REYES,MIXTO,OFICIAL,TÉCNICO,URBANO,5088
105088001431,IE LA CAMILA,MIXTO,OFICIAL,ACADÉMICO,URBANO,5088
105088001521,I.E. CENTENARIO DE BELLO,MIXTO,OFICIAL,TÉCNICO,URBANO,5088
105088001539,IE ANDRES BELLO,MIXTO,OFICIAL,TÉCNICO,URBANO,5088
105088001971,IE JOSEFA CAMPOS,MIXTO,OFICIAL,TÉCNICO,URBANO,5088
105088001679,COL SANTO DOMINGO DE GUZMAN,MIXTO,OFICIAL,TÉCNICO,URBANO,5088
105088001709,IE NUEVA GENERACION,MIXTO,OFICIAL,TÉCNICO,URBANO,5088
105088001750,I.E. FEDERICO SIERRA ARANGO,MIXTO,OFICIAL,ACADÉMICO,URBANO,5088
105088001792,INSTITUCION EDUCATIVA RAQUEL JARAMILLO,MIXTO,OFICIAL,NO APLICA,URBANO,5088
105088002641,IE LA NAVARRA,MIXTO,OFICIAL,ACADÉMICO,URBANO,5088
105088001911,IE COMERCIAL ANTONIO ROLDAN BETANCUR,MIXTO,OFICIAL,TÉCNICO/ACADÉMICO,URBANO,5088
305088002950,IE LICEO ANTIOQUEÑO,MIXTO,OFICIAL,TÉCNICO,URBANO,5088
105088002306,IE GILBERTO ECHEVERRI MEJIA,MIXTO,OFICIAL,ACADÉMICO,URBANO,5088
105088002896,IE CONCEJO DE BELLO,MIXTO,OFICIAL,TÉCNICO,URBANO,5088
105088003175,I.E. DE TRABAJO SAN JOSE,MIXTO,OFICIAL,ACADÉMICO,URBANO,5088
105091000012,I. E. PERLA DEL CITARA,MIXTO,OFICIAL,ACADÉMICO,URBANO,5091
105088800016,INSTITUCION EDUCATIVA BETSABÉ ESPINAL,MIXTO,OFICIAL,,URBANO,5088
105093000109,I. E. SAN JOSE,MIXTO,OFICIAL,TÉCNICO/ACADÉMICO,URBANO,5093
105113000071,I. E. SANTA GEMA,MIXTO,OFICIAL,ACADÉMICO,URBANO,5113
105101000172,I. E. MARIA AUXILIADORA,MIXTO,OFICIAL,ACADÉMICO,URBANO,5101
105101000571,I. E.  SAN JOSE DEL CITARA,MIXTO,OFICIAL,TÉCNICO/ACADÉMICO,URBANO,5101
105101000717,I. E. JOSE MARIA HERRAN,MIXTO,OFICIAL,ACADÉMICO,URBANO,5101
105107000166,I. E. ANTONIO ROLDAN BETANCUR,MIXTO,OFICIAL,ACADÉMICO,URBANO,5107
105120000345,I. E. MONSEÑOR GERARDO PATIÑO,MIXTO,OFICIAL,ACADÉMICO,URBANO,5120
105125000254,I. E. SAN JUAN BOSCO,MIXTO,OFICIAL,ACADÉMICO,URBANO,5125
105129000216,I. E. JOSE MARIA BERNAL,MIXTO,OFICIAL,ACADÉMICO,URBANO,5129
105129000534,I. E.  PEDRO LUIS ALVAREZ CORREA,MIXTO,OFICIAL,TÉCNICO/ACADÉMICO,URBANO,5129
105129000071,I. E. FEDERICO ANGEL,MIXTO,OFICIAL,ACADÉMICO,URBANO,5129
105129000089,I. E. GABRIEL ECHAVARRIA,MIXTO,OFICIAL,ACADÉMICO,URBANO,5129
105129000208,I. E. MARIA AUXILIADORA,MIXTO,OFICIAL,ACADÉMICO,URBANO,5129
105134000046,I. E.  NUESTRA SEÑORA DEL ROSARIO,MIXTO,OFICIAL,ACADÉMICO,URBANO,5134
105138000121,I. E. NICOLAS GAVIRIA,MIXTO,OFICIAL,ACADÉMICO,URBANO,5138
105147000401,I. E. COLOMBIA,MIXTO,OFICIAL,ACADÉMICO,URBANO,5147
105142000136,I. E. GABRIEL CORREA VELEZ,MIXTO,OFICIAL,ACADÉMICO,URBANO,5142
105145000145,I. E. JUAN PABLO GOMEZ OCHOA,MIXTO,OFICIAL,TÉCNICO/ACADÉMICO,URBANO,5145
205142000271,C. E. R. LA MARIA,MIXTO,OFICIAL,NO APLICA,RURAL,5142
105147000045,I. E. LUIS CARLOS GALAN SARMIENTO,MIXTO,OFICIAL,ACADÉMICO,URBANO,5147
205147000996,I.E.R. LA PROVINCIA,MIXTO,OFICIAL,,URBANO,5147
105147000568,I. E. JOSE MARIA MUÑOZ FLOREZ,MIXTO,OFICIAL,TÉCNICO/ACADÉMICO,URBANO,5147
105147000738,C. E. R. 25 DE AGOSTO,MIXTO,OFICIAL,NO APLICA,RURAL,5147
105148000243,I. E.  TECNICO INDUSTRIAL JORGE ELIECER GAITAN,MIXTO,OFICIAL,TÉCNICO/ACADÉMICO,URBANO,5148
105154000280,I. E. SANTO DOMINGO,MIXTO,OFICIAL,ACADÉMICO,URBANO,5154
105148000308,I. E. FRAY JULIO TOBON B.,MIXTO,OFICIAL,TÉCNICO/ACADÉMICO,URBANO,5148
105148001002,I.E. EL PROGRESO,MIXTO,OFICIAL,ACADÉMICO,URBANO,5148
105154000298,I. E. SANTA TERESITA,MIXTO,OFICIAL,ACADÉMICO,URBANO,5154
105148000863,I. E. CAMPESTRE NUEVO HORIZONTE,MIXTO,OFICIAL,TÉCNICO/ACADÉMICO,RURAL,5148
105150000099,I. E. PBRO JULIO TAMAYO,MIXTO,OFICIAL,TÉCNICO/ACADÉMICO,URBANO,5150
105172000238,I.E. GONZALO MEJIA,MIXTO,OFICIAL,ACADÉMICO,URBANO,5172
105154000301,I. E. LICEO CAUCASIA,MIXTO,OFICIAL,TÉCNICO/ACADÉMICO,URBANO,5154
105172000629,I. E. JUAN EVANGELISTA BERRIO,MIXTO,OFICIAL,ACADÉMICO,URBANO,5172
105154000409,I. E. MARCO FIDEL SUAREZ,MIXTO,OFICIAL,ACADÉMICO,URBANO,5154
105190000181,I. E. CISNEROS,MIXTO,OFICIAL,ACADÉMICO,URBANO,5190
